title,features
Grumpier Old Men,Grumpy Old Men Collection Romance Comedy Howard Deutch Warner Bros. Lancaster Gate United States of America
First Knight, Action Adventure Drama Romance Jerry Zucker Columbia Pictures Corporation First Knight Productions United States of America
Unzipped, Documentary Douglas Keeve  United States of America
Tommy Boy, Comedy Peter Segal Paramount Pictures United States of America
Frank and Ollie, Documentary Theodore Thomas Walt Disney Pictures Theodore Thomas Productions United States of America
Martin Lawrence: You So Crazy, Comedy Thomas Schlamme HBO Independent Productions United States of America
The Air Up There, Comedy Family Paul Michael Glaser Hollywood Pictures PolyGram Filmed Entertainment Interscope Communications Nomura Babcock & Brown NBB Unit One Film Partners Longview Entertainment United States of America
Fearless, Drama Peter Weir Spring Creek Productions Warner Bros. United States of America
With Honors, Comedy Drama Alek Keshishian Spring Creek Productions Warner Bros. United States of America
Lightning Jack, Action Comedy Western Simon Wincer Paul Hogan Greg Coote Savoy Pictures Australia United States of America
The Next Karate Kid,The Karate Kid Collection Adventure Christopher Cain Columbia Pictures Corporation United States of America
North, Comedy Drama Family Fantasy Science Fiction Rob Reiner Columbia Pictures New Line Cinema Castle Rock Entertainment United States of America
Welcome to the Dollhouse, Comedy Drama Todd Solondz  United States of America
Germinal, Drama Romance Claude Berri Renn Productions France 2 Cinéma DD Productions Belgium France Italy
Loaded, Drama Mystery Thriller Anna Campion  
Mystery Science Theater 3000: The Movie, Comedy Science Fiction Jim Mallon Universal Pictures Gramercy Pictures Best Brains United States of America
The Fan, Drama Mystery Thriller Tony Scott TriStar Pictures Mandalay Entertainment United States of America
Project S,Police Story Collection Action Adventure Crime Stanley Tong Golden Harvest Company Hong Kong
Gone with the Wind, Drama Romance War Victor Fleming Selznick International Pictures Metro-Goldwyn-Mayer (MGM) United States of America
Father of the Bride, Comedy Drama Family Romance Vincente Minnelli Metro-Goldwyn-Mayer (MGM) United States of America
Pete's Dragon, Fantasy Animation Comedy Family Don Chaffey Walt Disney Productions United States of America
Best of the Best 3: No Turning Back,Best of the Best Collection Action Phillip Rhee  United States of America
Return of the Jedi,Star Wars Collection Adventure Action Science Fiction Richard Marquand Lucasfilm Twentieth Century Fox Film Corporation United States of America
Stalker, Drama Science Fiction Thriller Andrei Tarkovsky Mosfilm Russia
Braindead, Horror Comedy Peter Jackson WingNut Films New Zealand Film Commission Avalon/NFU Studios New Zealand
The Bridge on the River Kwai, Drama History War David Lean Columbia Pictures Corporation Horizon Pictures (II) United Kingdom United States of America
The Shining, Horror Thriller Stanley Kubrick Hawk Films Warner Bros. Peregrine United States of America United Kingdom
The Preacher's Wife, Fantasy Drama Comedy Science Fiction Romance Family Penny Marshall Touchstone Pictures United States of America
B.A.P.S., Action Comedy Robert Townsend New Line Cinema Island Pictures 
Star Maps, Comedy Drama Miguel Arteta  
The Peacemaker, Action Thriller Mimi Leder DreamWorks SKG United States of America
The Leading Man, Thriller Drama Romance John Duigan J&M Entertainment BMG Independents United Kingdom
Friday the 13th Part 2,"Friday the 13th Collection Horror Thriller Steve Miner Paramount Pictures Georgetown Productions, Inc. United States of America"
Child's Play,Child's Play Collection Horror Thriller Tom Holland United Artists United States of America
Poltergeist III,Poltergeist Collection Horror Thriller Gary Sherman Metro-Goldwyn-Mayer (MGM) United States of America
Hot Lead & Cold Feet, Action Comedy Family Western Robert Butler  
Indiana Jones and the Temple of Doom,Indiana Jones Collection Adventure Action Steven Spielberg Lucasfilm Paramount Pictures United States of America
Adventures in Babysitting, Thriller Comedy Crime Adventure Chris Columbus Silver Screen Partners III Touchstone Pictures United States of America
The Thing,The Thing Collection Horror Mystery Science Fiction John Carpenter Universal Pictures Turman-Foster Company United States of America
Godzilla,Godzilla (Showa) Collection Thriller Horror Science Fiction Ishirô Honda Toho Film (Eiga) Co. Ltd. Japan
Pale Rider, Romance Western Clint Eastwood Warner Bros. Malpaso Company United States of America
The Thin Red Line, Drama History War Terrence Malick Fox 2000 Pictures Phoenix Pictures Geisler-Roberdeau Canada United States of America
Mighty Joe Young, Action Adventure Family Fantasy Ron Underwood Walt Disney Pictures RKO Pictures United States of America
Trick or Treat, Horror Music Charles Martin Smith De Laurentiis Entertainment Group (DEG) United States of America
Heartbreak Ridge, Action Comedy Drama War Clint Eastwood Malpaso Productions Jay Weston Productions United States of America
8MM,8MM Collection Thriller Crime Mystery Joel Schumacher Columbia Pictures Corporation Hofflund/Polone Global Entertainment Productions GmbH & Company Medien KG United States of America
Conquest of the Planet of the Apes,Planet of the Apes Original Collection Action Science Fiction J. Lee Thompson Twentieth Century Fox Film Corporation APJAC Productions United States of America
Dead Ringers, Drama Horror Thriller David Cronenberg Téléfilm Canada Morgan Creek Productions Mantle Clinic II Canada United States of America
Superman,Superman Collection Action Adventure Fantasy Science Fiction Richard Donner Warner Bros. Dovemead Films Film Export A.G. United Kingdom United States of America
Tarantula, Horror Science Fiction Thriller Jack Arnold Universal International Pictures (UI) United States of America
A Place at the Table, Documentary Kristi Jacobson Lori Silverbush  United States of America
The Blair Witch Project,Blair Witch Collection Horror Mystery Daniel Myrick Eduardo Sánchez Artisan Entertainment Haxan Films United States of America
Drop Dead Gorgeous, Comedy Michael Patrick Jann New Line Cinema Capella International KC Medien AG United States of America
The Raven, Comedy Fantasy Horror Roger Corman Alta Vista Productions United States of America
Tequila Sunrise, Action Adventure Crime Romance Thriller Robert Towne The Mount Company Warner Bros. Cinema City Films United States of America
Days of Heaven, Drama Romance Terrence Malick Paramount Pictures United States of America
Gilda, Drama Romance Thriller Charles Vidor Columbia Pictures United States of America
Joe the King, Crime Drama Frank Whaley Lower East Side Films 49th Parallel Productions Forensic/291 Films United States of America
Felicia's Journey, Drama Atom Egoyan Alliance Atlantis Communications Icon Entertainment International Marquis Films Ltd Canada United Kingdom
Magnolia, Drama Paul Thomas Anderson New Line Cinema Ghoulardi Film Company The Magnolia Project United States of America
Raining Stones, Comedy Drama Ken Loach Channel Four Films Parallax Pictures United Kingdom
The Wild McCullochs," Romance Drama Max Baer, Jr.  United States of America"
My Tutor, Comedy Drama Romance George Bowers Crown International Pictures Marimark Productions United States of America
Slaves to the Underground, Comedy Music Drama Kristine Peterson  
A Place in the Sun, Drama Romance George Stevens Paramount Pictures United States of America
Lucas, Comedy Drama Romance David Seltzer Twentieth Century Fox Film Corporation United States of America
The Road to El Dorado, Adventure Animation Comedy Family Don Michael Paul Bibo Bergeron DreamWorks SKG DreamWorks Animation United States of America
My Life, Drama Romance Bruce Joel Rubin Columbia Pictures Corporation Zucker Brothers Productions Capella Films United States of America
Gossip, Drama Mystery Thriller Davis Guggenheim Village Roadshow Pictures NPV Entertainment Warner Bros. Outlaw Productions (I) United States of America
The Myth Of Fingerprints, Drama Comedy Bart Freundlich Eureka Pictures Good Machine United States of America
Shanghai Noon,Shanghai Noon Collection Adventure Action Comedy Western Tom Dey Spyglass Entertainment Roger Birnbaum Productions Touchstone Pictures Hong Kong United States of America
Sunshine, Drama History István Szabó Channel Four Films Dor Film Produktionsgesellschaft GmbH Alliance Atlantis Communications Serendipity Point Films Téléfilm Canada Eurimages Kinowelt Filmproduktion Bavaria Film and Television Fund Hungarian Motion Picture Fund ISL Film InterCom The Movie Network (TMN) TV2 Vienna Film Financing Fund Österreichischer Rundfunk (ORF) Starhaus Filmproduktion Austria Canada Germany Hungary
Boys and Girls, Comedy Drama Romance Robert Iscove Punch 21 Productions United States of America
Butterfly, Drama José Luis Cuerda Televisión Española (TVE) Canal+ España Televisión de Galicia (TVG) S.A. Las Producciones del Escorpión S.L. Sociedad General de Televisión (Sogetel) Spain
The Bank Dick, Comedy Edward F. Cline Universal Studios United States of America
Requiem for a Dream, Crime Drama Darren Aronofsky Artisan Entertainment United States of America
102 Dalmatians,101 Dalmatians (Live-Action) Collection Comedy Family Kevin Lima Walt Disney Pictures Cruella Productions United States of America
Sugar & Spice, Crime Comedy Francine McDougall New Line Cinema United States of America
Critical Condition, Comedy Michael Apted Paramount Pictures United States of America
Of Mice and Men, Drama Lewis Milestone United Artists Hal Roach Studios United States of America
The Abominable Dr. Phibes,Dr. Phibes Collection Comedy Horror Robert Fuest American International Pictures (AIP) United Kingdom United States of America
Necessary Roughness, Comedy Stan Dragoti Paramount Pictures United States of America
The Tailor of Panama, Drama Thriller John Boorman Columbia Pictures Merlin Films Ireland United States of America
Rio Bravo, Western Howard Hawks Warner Bros. United States of America
Bat*21, Action Drama War Peter Markle TriStar Pictures Vision PDG United States of America
Dirty Rotten Scoundrels, Crime Comedy Frank Oz Orion Pictures United States of America
Bill & Ted's Excellent Adventure,Bill & Ted's Most Excellent Collection Adventure Comedy Science Fiction Stephen Herek Orion Pictures United States of America
Cyborg,Cyborg Collection Action Science Fiction Albert Pyun Cannon Group Golan-Globus United States of America
The War of the Roses, Comedy Drama Thriller Danny DeVito Gracie Films Twentieth Century Fox Film Corporation United States of America
Orphans," Comedy Drama Peter Mullan Antoinine Green Bridge Scottish Arts Council, The The Scottish Arts Council "
The Big Brawl, Action Comedy Robert Clouse  Hong Kong United States of America
Sidewalks of New York, Comedy Drama Romance Edward Burns Paramount Classics United States of America
Joy Ride,Joy Ride Collection Mystery Thriller Drama John Dahl Regency Enterprises Epsilon Motion Pictures LivePlanet New Regency Pictures Bad Robot United States of America
Divine Madness, Music Michael Ritchie The Ladd Company United States of America
Not Without My Daughter, Drama Thriller Brian Gilbert Pathé Entertainment Metro-Goldwyn-Mayer (MGM) Ufland United States of America
The Holcroft Covenant, Action Crime Thriller John Frankenheimer Thorn EMI Screen Entertainment United Kingdom
Dragonslayer, Fantasy Matthew Robbins Paramount Pictures Walt Disney Productions United Kingdom
Galaxina, Comedy Science Fiction William Sachs Marimark Productions United States of America
He Knows You're Alone, Horror Armand Mastroianni Metro-Goldwyn-Mayer (MGM) United States of America
Life Is to Whistle,  Fernando Pérez  
Clockstoppers, Adventure Family Science Fiction Thriller Jonathan Frakes Paramount Pictures Nickelodeon Movies Valhalla Motion Pictures United States of America
30 YEARS TO LIFE, Comedy Romance Drama Vanessa Middleton  
The Atomic Cafe, Documentary History Jayne Loader Kevin Rafferty Pierce Rafferty  United States of America
Body and Soul, Drama Robert Rossen Enterprise Productions United States of America
3:10 to Yuma, Drama Western Delmer Daves Columbia Pictures Corporation United States of America
The Coca-Cola Kid, Comedy Drama Romance Dusan Makavejev Australian Film Commission Cinema Enterprises Grand Bay Films International Pty. Australia
The Cassandra Crossing, Drama Thriller George P. Cosmatos Associated General Films International Cine Productions Germany Italy United Kingdom
My Beautiful Laundrette, Romance Drama Comedy Stephen Frears Channel Four Films Working Title Films SAF Productions United Kingdom
The Lady in Red, Action Thriller Lewis Teague New World Pictures United States of America
Summer Holiday, Music Romance Peter Yates Associated British Picture Corporation United Kingdom
Pumpkin, Comedy Drama Romance Anthony Abrams Adam Larson Broder  United States of America
Perfect, Drama Romance James Bridges Columbia Pictures Corporation Delphi III Productions Pluperfect United States of America
The Legend of Boggy Creek, Mystery Horror Drama Charles B. Pierce P & L United States of America
Beau Pere, Drama Romance Bertrand Blier Sara Films Antenne-2 (A2) France
Rollerball, Adventure Action Science Fiction Norman Jewison Algonquin United Kingdom
One Hour Photo, Horror Thriller Mark Romanek Fox Searchlight Pictures Catch 23 Entertainment United States of America
Secretary, Comedy Drama Romance Steven Shainberg Slough Pond double A Films United States of America
The Man from Elysian Fields, Drama Romance George Hickenlooper Shoreline Entertainment Fireworks Pictures Gold Circle Films CineSon Entertainment Pfilmco TVA International United States of America
The Pumaman, Science Fiction Action Alberto De Martino  Italy
Eye of the Needle, Action Drama Romance Thriller Richard Marquand Kings Road Entertainment United Kingdom
Polyester, Comedy John Waters New Line Cinema United States of America
Casino Royale,James Bond Collection Adventure Action Comedy John Huston Robert Parrish Val Guest Joseph McGrath Ken Hughes Columbia Pictures Corporation Famous Artists Productions United Kingdom United States of America
The Way Home, Drama Family Lee Jeong-hyang CJ Entertainment Tube Entertainments South Korea
Eight Crazy Nights, Comedy Animation Seth Kearsley Columbia Pictures Happy Madison Productions Meatball Animation United States of America
Treasure Planet, Adventure Animation Family Fantasy Science Fiction Ron Clements John Musker Walt Disney Pictures Walt Disney Feature Animation United States of America
The Last Seduction II, Thriller Romance Terry Marcel  
Legend of the Lost, Adventure Drama Henry Hathaway United Artists Batjac Productions Dear Film Produzione Italy United States of America
WiseGirls, Action Comedy Drama Thriller David Anspaugh  Canada United Kingdom United States of America
The Simple-Minded Murderer, Drama Hans Alfredson AB Svenska Ord Sweden
The Secret Policeman's Other Ball, Comedy Music Julien Temple Roger Graef  
White Dog, Horror Drama Thriller Samuel Fuller Paramount Pictures United States of America
Gods and Generals, Drama History War Ronald F. Maxwell Warner Bros. Pictures Turner Pictures Antietam Filmworks United States of America
The Awful Truth, Comedy Drama Romance Leo McCarey Columbia Pictures Corporation United States of America
Day for Night, Comedy Drama François Truffaut Les Films du Carrosse PECF Produzione Intercontinentale Cinematografica (PIC) France Italy
Identity, Mystery Thriller James Mangold Konrad Pictures Columbia Pictures Corporation United States of America
The Rare Breed, Western Andrew V. McLaglen Universal Pictures United States of America
Start the Revolution Without Me, Comedy History Bud Yorkin Warner Bros. NorBud Productions Norbud Films United States of America
Juggernaut, Thriller Action Crime Richard Lester David V. Picker Productions Two Roads Productions Spain United Kingdom United States of America
Freaky Friday, Comedy Mark Waters Walt Disney Pictures Gunn Films Casual Friday Productions United States of America
The Day of the Dolphin, Action Crime Drama Science Fiction Thriller Mike Nichols AVCO Embassy Pictures United States of America
Me & Isaac Newton, Documentary Michael Apted  
Angie, Comedy Drama Romance Martha Coolidge Caravan Pictures Hollywood Pictures United States of America
Sunday in the Country, Drama Crime Thriller John Trent Canadian Film Development Corporation (CFDC) Impact Films Quadrant Films United Kingdom Canada
Sweet Sixteen, Crime Drama Ken Loach Alta Films S.A. TTornasol Films S.A. United Kingdom
Interstate 60, Adventure Comedy Drama Fantasy Mystery Bob Gale Fireworks Pictures Canada United States of America
Sherlock Holmes Faces Death,Sherlock Holmes (1939 series) Drama Mystery Thriller Roy William Neill  
The Solid Gold Cadillac, Comedy Romance Richard Quine Columbia Pictures Corporation United States of America
Broken Blossoms, Drama Romance D.W. Griffith United Artists D.W. Griffith Productions United States of America
Thunderheart, Action Adventure Crime Mystery Thriller Michael Apted TriStar Pictures United States of America
Crazy People, Comedy Romance Tony Bill Barry L. Young Paramount Pictures Intuitive TV United States of America
Queen of Hearts, Comedy Romance Foreign Jon Amiel  
Plaza Suite, Comedy Drama Romance Arthur Hiller Paramount Pictures United States of America
Vanishing Point, Action Thriller Drama Richard C. Sarafian Twentieth Century Fox Film Corporation Cupid Productions United States of America
The Cat and the Canary, Thriller Foreign Mystery Horror Comedy Radley Metzger Grenadier Films United Kingdom
The Punisher, Action Crime Drama Jonathan Hensleigh Lions Gate Films VIP 3 Medienfonds Valhalla Motion Pictures Marvel Enterprises VIP 2 Medienfonds Germany United States of America
13 Going on 30, Comedy Fantasy Romance Gary Winick Columbia Pictures Revolution Studios Thirteen Productions United States of America
Man on Fire, Action Drama Thriller Crime Tony Scott Regency Enterprises Fox 2000 Pictures Epsilon Motion Pictures Scott Free Productions New Regency Pictures United Kingdom United States of America
Along the Coast, Documentary Agnès Varda Argos Films France
Soldier of Orange, Drama History Thriller War Paul Verhoeven Film Holland Excelsior Films The Rank Organisation Belgium Netherlands
Good Guys Wear Black, Action Thriller Ted Post  United States of America
Pure Country, Drama Music Romance Christopher Cain  United States of America
Shiri, Action Adventure Drama Thriller Kang Je-gyu Samsung Entertainment South Korea
Dexter the Dragon & Bumble the Bear, Animation Harrie Geelen Rob Houwer Productions Netherlands
Oliver Twist, Adventure Drama Family David Lean Cineguild United Kingdom
Plain Dirty, Romance Thriller Drama Zev Berman Tonic Films Down Home Entertainment Wind Chill Productions United States of America
Taxi,Taxi Collection Action Comedy Crime Gérard Pirès ARP Sélection Cofimage 9 TF1 Films Production Canal+ EuropaCorp Studio Image 4 France
Gray Lady Down, Thriller Adventure History Drama David Greene Universal Pictures The Mirisch Corporation United States of America
In a Glass Cage, Drama Horror Agustí Villaronga T.E.M. Productores S.A. Spain
Funny About Love, Comedy Drama Romance Leonard Nimoy Paramount Pictures United States of America
Slaughter of the Innocents, Horror Action Thriller Mystery James Glickenhaus Shapiro-Glickenhaus Entertainment United States of America
The Belly of an Architect, Drama Peter Greenaway British Screen Sacis Film Four International Hemdale Group Mondial Callender Company Tangram Film Italy United Kingdom
Kotch, Comedy Drama Jack Lemmon American Broadcasting Company (ABC) United States of America
Sherlock Holmes and the Secret Weapon,Sherlock Holmes (1939 series) Action Adventure Crime Drama Mystery Thriller Roy William Neill Universal Pictures United States of America
A Dirty Shame, Comedy John Waters Fine Line Features Killer Films John Wells Productions This Is That Productions United States of America
Shaun of the Dead, Horror Comedy Edgar Wright Universal Pictures Big Talk Productions StudioCanal Film4 Working Title Films WT2 Productions De Wolfe Music Inside Track 2 United Kingdom United States of America France
The Decline of the American Empire, Comedy Drama Denys Arcand Corporation Image M & M Societe Radio Cinema Canada
Spin, Family Drama James Redford Spin Prods. LLC United States of America
Ray, Drama Music Taylor Hackford Universal Pictures Bristol Bay Productions Baldwin Entertainment Group Anvil Films United States of America
Portrait of Jennie, Drama Fantasy Romance William Dieterle Vanguard Films Selznick International Pictures United States of America
The Unknown,I Love a Mystery movie series Drama Horror Romance Tod Browning Metro-Goldwyn-Mayer (MGM) United States of America
The Son of Kong,King Kong (1933 series) Adventure Horror Action Science Fiction Ernest B. Schoedsack RKO Radio Pictures United States of America
Wild Boys of the Road, Drama William A. Wellman First National Pictures Warner Bros. United States of America
The Dawn Patrol, Action Drama War Edmund Goulding Warner Bros. United States of America
Across the Pacific, Adventure Drama Romance War John Huston Warner Bros. United States of America
The Unknown Soldier, Drama War Edvin Laine Suomen Filmiteollisuus Finland
The Train, Action Drama Thriller War John Frankenheimer Les Productions Artistes Associés Les Films Ariane Dear Film Produzione France United States of America
Tony Rome, Crime Mystery Thriller Gordon Douglas Arcola Pictures United States of America
Dracula Has Risen from the Grave,Dracula (Hammer Series) Horror Freddie Francis Hammer Film Productions United Kingdom
The Hound of the Baskervilles, Drama Horror Comedy Thriller Crime Mystery Paul Morrissey  United Kingdom
The Adventures of Picasso, Comedy Tage Danielsson Svensk Filmindustri (SF) Svenska Ord Sweden
La Luna, Drama Bernardo Bertolucci Fiction Cinematografica S.p.a. 20th Century Fox Film Corporation Italy United States of America
Children's Island, Drama Family Kay Pollak  
Law of Desire, Comedy Drama Romance Pedro Almodóvar Laurenfilm Spain
Shout, Drama Romance Jeffrey Hornaday Universal Pictures Robert Simonds Productions United States of America
Deadly Advice,  Mandie Fletcher  
Leningrad Cowboys Meet Moses,Leningrad Cowboys Collection Adventure Comedy Music Aki Kaurismäki  Czech Republic Germany France Poland United States of America
Sonatine, Action Crime Thriller Takeshi Kitano Bandai Visual Company Shôchiku Eiga Shouchiku Co. Yamada Right Vision Corporation Japan
Darkman II: The Return of Durant,Darkman Collection Action Adventure Science Fiction Thriller Bradford May Renaissance Pictures United States of America
A Summer's Tale,Tales of the Four Seasons Comedy Drama Romance Éric Rohmer Les Films du Losange Canal+ La Sept Cinéma Sofilmka France
Nirvana, Thriller Fantasy Science Fiction Gabriele Salvatores Davis-Films Cecchi Gori Group Tiger Cinematografica Colorado Film Production Italy
Sophie's World, Fantasy Drama Family Erik Gustavson SF Norge Produksjon Norway
An Injury to One, Documentary Travis Wilkerson  United States of America
The Jacket, Drama Mystery Thriller Fantasy John Maybury Section Eight Mandalay Pictures VIP 3 Medienfonds 2929 Productions Rising Star VIP 2 Medienfonds Warner Independent Pictures (WIP) Germany United States of America
Windstruck, Comedy Drama Kwak Jae-yong  South Korea
In Good Company, Comedy Drama Romance Paul Weitz Depth of Field United States of America
The River, Drama Foreign Romance Tsai Ming-liang  Taiwan
Wizards, Animation Fantasy Science Fiction Ralph Bakshi Twentieth Century Fox Film Corporation Bakshi Productions United States of America
Pippi on the Run,Pippi Longstocking Family Olle Hellbom  Germany Sweden
Gorgeous, Adventure Action Comedy Romance Vincent Kok Golden Harvest Pictures Hong Kong
Night Watch,World of Watches Collection Fantasy Action Thriller Timur Bekmambetov Bazelevs Production Channel One Russia TABBAK The First Channel Russia
Tart, Comedy Drama Romance Christina Wayne Interlight Green Moon Productions Canada United States of America
The Pacifier, Action Comedy Drama Family Thriller Adam Shankman Walt Disney Pictures Spyglass Entertainment Canada United States of America
Be Cool,Chili Palmer Collection Comedy Crime F. Gary Gray Double Feature Films Jersey Films Nina Saxon Film Design Metro-Goldwyn-Mayer (MGM) United States of America
The Sword of Doom, Action Drama Kihachi Okamoto Takarazuka Eiga Company Ltd. Japan
Snake and Crane Arts of Shaolin, Drama Action Foreign Chen Chi-Hwa Lo Wei Motion Picture Company Hong Kong Taiwan
Down and Derby, Comedy Family Eric Hendershot Stonehaven Media Pure Entertainment United States of America
The Devil's Rejects,House of 1000 Corpses Collection Drama Horror Crime Rob Zombie Lions Gate Films Cinerenta Medienbeteiligungs KG Firm Films Cinelamda Internationale Filmproduktionsgesellschaft Germany United States of America
Blue Hill Avenue, Crime Drama Craig Ross Jr.  United States of America
The Anderson Tapes, Action Crime Drama Thriller Sidney Lumet Columbia Pictures Corporation Robert M. Weitman Productions United States of America
Medea, Drama Lars von Trier Danmarks Radio (DR) Denmark
Bubble, Drama Crime Mystery Steven Soderbergh Magnolia Pictures Extension 765 United States of America
The Profession of Arms, Adventure Drama History War Ermanno Olmi StudioCanal Eurimages Rai Cinema Taurus Produktion Boyana Film Cinemaundici Ministero per i Beni e le Attività Culturali (MiBAC) Italy France Germany Bulgaria
Dandelion, Drama Romance Mark Milgard  United States of America
