title,features
Manderlay,USA: Land of Opportunities Collection Drama Lars von Trier Zentropa Entertainments Danmarks Radio (DR) Arte Memfis Film Isabella Films BV Degeto Film Ognon Pictures Sveriges Television (SVT) Canal+ Yleisradio (YLE) Arte France Cinéma Westdeutscher Rundfunk (WDR) Alan Young Pictures Nederlandse Programma Stichting (NPS) Canal+ Television AB Film i Väst Invicta Capital Edith Film Oy Pain Unlimited GmbH Filmproduktion Sigma Films Manderlay Denmark France Germany Italy Netherlands Sweden United Kingdom
Dead Man's Shoes, Drama Thriller Crime Shane Meadows EM Media Big Arty Productions Film4 Warp Films United Kingdom
The Brides of Dracula,Dracula (Hammer Series) Horror Terence Fisher Hammer Film Productions Hotspur Film Productions Ltd. United Kingdom
Richard Pryor: Live in Concert, Comedy Jeff Margolis  United States of America
Yamakasi,Yamakasi - Collection Action Crime Drama Ariel Zeitoun Julien Seri  France
Casper Meets Wendy,Casper Collection Family Comedy Adventure Sean McNamara Saban Entertainment 20th Century Fox Home Entertainment The Harvey Entertainment Company United States of America
The Dark, Horror Thriller Mystery John Fawcett Constantin Film Impact Pictures Isle of Man Film UK Film Council Germany United Kingdom
Leprechaun 4: In Space,Leprechaun Collection (Original Series) Comedy Fantasy Horror Science Fiction Brian Trenchard-Smith Front Street Studios United States of America
Kummeli Stories, Comedy Matti Grönberg Kinoproduction Oy Porkkana Ryhmä Yleisradio (YLE) Finland
Secrets of a Soul, Thriller Drama G.W. Pabst Neumann-Filmproduktion Germany
Ivanhoe, Drama History Adventure Douglas Camfield Columbia Pictures Television Rosemont Productions United Kingdom
The Criminal Life of Archibaldo de la Cruz, Comedy Crime Drama Luis Buñuel Alianza Cinematográfica Española Mexico
Bio Zombie, Horror Comedy Foreign Wilson Yip  Hong Kong
Union Pacific, Drama Western Cecil B. DeMille Paramount Pictures United States of America
Offside, Drama Comedy Foreign Jafar Panahi Jafar Panahi Film Productions Iran
Reeker,"Reeker Collection Horror Mystery Dave Payne Institution, The Primal Pictures Afraid of the Dark United States of America"
Zombie Honeymoon, Horror David Gebroe Glass Eye Pix United States of America
The Man Who Never Was, Thriller War Drama History Ronald Neame Twentieth Century Fox Film Corporation Sumar Productions United Kingdom
The History Boys, Comedy Drama Nicholas Hytner DNA Films BBC Films UK Film Council United Kingdom
Rolling Family, Drama Comedy Pablo Trapero  Argentina Brazil France Germany Spain United Kingdom
The Savage Innocents, Drama Nicholas Ray Paramount Pictures Gray Film Joseph Janni Production France Italy United Kingdom
Golden Door, History Drama Romance Emanuele Crialese Banque Populaire Images 6 Cofimage 16 Cofinova 2 MEDIA Programme of the European Union mementoFilm Respiro Sofica Europacorp Titti Film Wild Bunch France Italy
First on the Moon, Mystery Science Fiction Aleksey Fedorchenko Sverdlovskaya Kinostudiya Kinokompaniya Strana Russia
The Situation, Drama History Romance Thriller Philip Haas Red Wine Pictures United States of America
Right at Your Door, Drama Thriller Chris Gorak  United States of America
Fay Grim,Henry Fool Collection Comedy Thriller Hal Hartley A & A Release United States of America
The Homecoming, Drama Peter Hall  
Live Free or Die Hard,Die Hard Collection Action Thriller Len Wiseman Ingenious Film Partners Twentieth Century Fox Film Corporation Dune Entertainment Cheyenne Enterprises Wintergreen Productions United Kingdom United States of America
Arn: The Knight Templar,Arn collection Action Adventure Drama Romance Peter Flinth Danmarks Radio (DR) Telepool AMC Pictures TV4 Sweden SF Norge Molinare Studios Yleisradio (YLE) Svensk Filmindustri (SF) Juonifilmi TV2 Norge Film i Väst Soundchef Studios Arion Communications Ltd. Dagsljus Filmequipment Sheba Films Sandline Production Europa Film Sound Production Sweden
First Snow, Drama Thriller Mark Fergus Yari Film Group Furst Films Germany United States of America
No Time For Sergeants, Comedy Drama Mervyn LeRoy Warner Bros. United States of America
Who's Your Caddy?, Comedy Don Michael Paul The Weinstein Company Dimension Films Metro-Goldwyn-Mayer (MGM) United States of America
Illegal Tender, Drama Action Thriller Crime Franc. Reyes  United States of America
House of Bamboo, Crime Drama Samuel Fuller Twentieth Century Fox Film Corporation United States of America
Rendition, Drama Thriller Gavin Hood Anonymous Content Level 1 Entertainment MID Foundation United States of America
The Comebacks, Comedy Tom Brady Fox Atomic United States of America
Alvin and the Chipmunks,Alvin and the Chipmunks Collection Comedy Music Family Fantasy Animation Tim Hill Dune Entertainment Regency Enterprises Fox 2000 Pictures Bagdasarian Productions United States of America
Pledge This!, Comedy William Heins Paris Hilton Entertainment Pledge This Holdings United States of America
P.S. I Love You, Drama Romance Richard LaGravenese Wendy Finerman Productions Alcon Entertainment Grosvenor Park Productions United States of America
U2 3D, Music Documentary Mark Pellington Catherine Owens National Geographic Entertainment 3ality Digital Entertainment United States of America
The Air I Breathe, Drama Action Thriller Crime Jieho Lee NALA Films Mexico United States of America
Step Up 2: The Streets,Step Up Collection Music Drama Romance Jon M. Chu Summit Entertainment Offspring Entertainment Touchstone Pictures United States of America
Mala Noche, Drama Gus Van Sant  United States of America
Alatriste, Action Agustín Díaz Yanes Twentieth Century Fox Film Corporation Estudios Picasso NBC Universal Global Networks Origen Producciones Cinematograficas S.A. Spain
Why Not?, Drama Shôhei Imamura Shôchiku Eiga Imamura Productions Japan
Hero Wanted, Action Adventure Crime Drama Thriller Brian Smrz  United States of America
The Lost World, Adventure Fantasy Science Fiction Irwin Allen Twentieth Century Fox Film Corporation United States of America
Tell It to the Marines, Action Comedy Drama George W. Hill Metro-Goldwyn-Mayer (MGM) United States of America
Pocket Money, Action Comedy Western Stuart Rosenberg First Artists Coleytown Productions United States of America
Hour of the Gun, Action Drama Western John Sturges The Mirisch Corporation Mirisch-Kappa Production United States of America
Welcome to the Sticks, Comedy Dany Boon Nicolas Guy Centre National de la Cinématographie TF1 Films Productions Pathé Renn Productions Hirsch Canal+ CinéCinéma Région Nord-Pas-de-Calais Les Productions du Chicon Centre Régional des Ressources Audiovisuelles (CRRAV) France
Watching the Detectives, Comedy Romance Paul Soter  United States of America
The Boys in Company C, Drama War Sidney J. Furie Columbia Pictures Golden Harvest Company Good Times Films S.A. Hong Kong Philippines United States of America
Import/Export, Drama Ulrich Seidl Pronto Film Austria Slovakia Ukraine
The Drowning Pool,Lew Harper Collection Drama Mystery Thriller Stuart Rosenberg David Foster Productions Turman-Foster Company First Artists Coleytown United States of America
Saw V,Saw Collection Horror Thriller Crime David Hackl Lionsgate Twisted Pictures United States of America
Cadillac Records, Drama History Music Darnell Martin Parkwood Entertainment United States of America
Six in Paris, Comedy Drama Jean-Luc Godard Claude Chabrol Éric Rohmer Jean-Daniel Pollet Jean Rouch Jean Douchet Les Films du Losange Les Filmes du Cyprès France
Brotherhood of Death, Action Drama Bill Berry International Film Consortium Bellwether Films Berwether Inc. United States of America
Ip Man,Ip Man Collection Drama Action History Wilson Yip Mandarin Films Distribution Co. Hong Kong
Fuel, Drama Oktay Ortabasi  
Belle of the Nineties, Drama Comedy Leo McCarey Paramount Pictures United States of America
Funny People, Comedy Drama Judd Apatow Columbia Pictures Universal Pictures Happy Madison Productions Relativity Media Apatow Productions Madison 23 United States of America
Two Men in Manhattan, Crime Drama Mystery Thriller Jean-Pierre Melville  France
Blue Steel, Action Western Robert N. Bradbury  United States of America
The Small Back Room, War Drama Thriller Emeric Pressburger Michael Powell London Film Productions The Archers United Kingdom
Fraternity Demon, Comedy C.B. Rubin  
Up, Animation Comedy Family Adventure Pete Docter Pixar Animation Studios United States of America
Trojan War, Comedy George Huang Daybreak Pictures Warner Bros. United States of America
Ricky Rapper, Comedy Family Music Foreign  Kinotar Finland
The Stoning of Soraya M., Crime Drama Cyrus Nowrasteh Roadside Attractions Mpower Pictures Prime Meridian Pctures Fallen Films United States of America
(500) Days of Summer, Comedy Drama Romance Marc Webb Fox Searchlight Pictures Watermark Dune Entertainment III United States of America
Through the Olive Trees,Koker Trilogy Drama Abbas Kiarostami Ciby 2000 Abbas Kiarostami Productions Farabi Cinema Foundation Iran France
The Group, Drama Sidney Lumet Famartists Productions S.A. United States of America
Jonathan Livingston Seagull, Drama Family Science Fiction Hall Bartlett Paramount Pictures United States of America
"A Time to Live, a Time to Die", Drama Hou Hsiao-hsien Central Motion Pictures Corporation Taiwan
Stone of Destiny, Drama Adventure Crime Charles Martin Smith  Canada United Kingdom
Vacancy 2: The First Cut,Vacancy Collection Horror Thriller Eric Bross Stage 6 Films United States of America
Witch Hunt, Documentary Crime Don Hardy Jr. Dana Nachman  United States of America
Valentino: The Last Emperor, Documentary Matt Tyrnauer Acolyte Films United States of America
Laid to Rest,Laid to Rest Collection Thriller Horror Robert Hall Dry County Films United States of America
Still Walking, Drama Family Hirokazu Koreeda Bandai Visual Company Eisei Gekijo TV Man Union Cinequanon Engine Film Group Japan
"The Pit, the Pendulum and Hope", Animation Horror Mystery Jan Švankmajer Krátký Film Praha 
The Extraordinary Adventures of Mr. West in the Land of the Bolsheviks, Adventure Comedy Lev Kuleshov Goskino Russia
23 Paces to Baker Street, Crime Mystery Thriller Henry Hathaway Twentieth Century Fox Film Corporation United States of America
Big Fan, Comedy Drama Robert D. Siegel Big Fan Productions United States of America
The Lusty Men, Action Drama Western Nicholas Ray Robert Parrish Wald/Krasna Productions United States of America
Our Daily Bread, Documentary Foreign Nikolaus Geyrhalter 3sat Nikolaus Geyrhalter Filmproduktion Österreichischer Rundfunk (ORF) Zweites Deutsches Fernsehen (ZDF) Filmfonds Wien Österreichisches Filminstitut Austria Germany
Cell 211, Action Thriller Drama Daniel Monzón Telecinco Cinema Canal+ Vaca Films La Fabrique 2 Morena Films Sofica Soficinéma 4 France Spain
Hoop Reality,  Lee Davis  
Asylum, Horror Science Fiction David R. Ellis Hyde Park Films Mad Scientist Productions United States of America
Planet 51, Science Fiction Animation Family Comedy Adventure Jorge Blanco Javier Abad Marcos Martínez TriStar Pictures Ilion Animation Studios Hand Made Films Spain United Kingdom United States of America
Invaders from Mars, Mystery Science Fiction Horror Tobe Hooper Cannon Pictures United States of America
Trapeze, Drama Carol Reed Joanna Productions United States of America
Agent Red, Action Thriller Jim Wynorski Damian Lee  United States of America
10 MPH, Documentary Hunter Weeks  
Hidden Agenda, Action Thriller Marc S. Grenier Dream Rock EGM Productions Cinequest Films Canada
Asterix at the Olympic Games,Asterix and Obelix Collection Fantasy Adventure Comedy Family Thomas Langmann Frédéric Forestier Constantin Film TF1 Films Productions Pathé Renn Productions La Petite Reine Tri Pictures Sorolla Films Novo RPI Canal+ uFilm Canal+ España Le Tax Shelter du Gouvernement Fédéral de Belgique Les Editions Albert René Belgium France Germany Italy Spain
Désirée, Drama Romance Henry Koster Twentieth Century Fox Film Corporation United States of America
The Secret of Santa Vittoria, Comedy Drama War Stanley Kramer Stanley Kramer Productions United States of America
Killer Bean 2: The Party,  Jeff Lew  
Possession, Drama Thriller Romance Joel Bergvall Simon Sandquist Vertigo Entertainment Yari Film Group Spitfire Pictures Addicted Productions United States of America
Flesh and the Devil, Drama Romance Clarence Brown Metro-Goldwyn-Mayer (MGM) United States of America
Dark Mirror, Horror Thriller Pablo Proenza Cut Glass Productions LLC United States of America
Air Doll, Drama Hirokazu Koreeda Bandai Visual Company (JAPAN) Engine Films Asmik Ace Entertainment Eisei Gekijo TV Man Union Japan
Peacock, Mystery Thriller Michael Lander Lionsgate United States of America
The Roman Spring of Mrs. Stone, Drama Romance José Quintero Seven Arts Productions Warner Bros. United States of America
The Silent Partner, Crime Drama Thriller Daryl Duke Carolco Pictures Canada
LEGO: The Adventures of Clutch Powers, Action Adventure Animation Family Howard E. Baker Threshold Animation Studios United States of America
The Losers, Action Adventure Crime Mystery Thriller Sylvain White DC Comics Weed Road Pictures Dark Castle Entertainment Warner Bros. DC Entertainment United States of America
Julia Sweeney - Letting Go of God," Comedy Documentary Julia Sweeney Five Sisters Productions Indefatigable, Inc. United States of America"
Cargo, Thriller Mystery Science Fiction Ivan Engler Ralph Etter Telepool Atlantis Pictures Schweizerische Radio- und Fernsehgesellschaft (SRG) Ascot Elite Entertainment Group Egli Film Teleclub AG Centauri Media Switzerland
American Gothic, Horror John Hough  
Buried, Drama Thriller Mystery Rodrigo Cortés Studio 37 Versus Entertainment The Safran Company Dark Trick Films Spain United States of America France
Hoffman, Comedy Drama Romance Alvin Rakoff Associated British Picture Corporation (ABPC) United Kingdom
Reunion, Drama War Jerry Schatzberg  
Gigot, Drama Gene Kelly Seven Arts Productions United States of America
The Ashes, War Drama Andrzej Wajda Film Polski Poland
24: Redemption, Action Adventure Crime Jon Cassar Imagine Television Teakwood Lane Productions Real Time Productions United States of America South Africa
Dead Air, Horror Science Fiction Thriller Corbin Bernsen Team Cherokee Productions Antibody Films United States of America
Gumshoe, Drama Comedy Crime Mystery Thriller Stephen Frears Columbia Pictures Corporation Memorial Enterprises United Kingdom
Mammy, Music Comedy Michael Curtiz Warner Bros. United States of America
Mr. Nobody, Science Fiction Drama Romance Fantasy Jaco Van Dormael Pan Européenne Production Virtual Films Belgium Canada France Germany
Deadly Outlaw: Rekka, Action Drama Foreign Thriller Takashi Miike  Japan
Lucky, Comedy Documentary Romance Jeffrey Blitz  United States of America
The Mating Season, Comedy Mitchell Leisen Paramount Pictures United States of America
Retribution, Crime Drama Foreign Horror Mystery Science Fiction Thriller Kiyoshi Kurosawa Tokyo Broadcasting System Japan
Dirty Ho, Action Comedy Foreign Liu Chia-Liang Shaw Brothers Hong Kong
Machete,Machete Collection Action Comedy Thriller Robert Rodriguez Ethan Maniquis Dune Entertainment Dune Entertainment III Troublemaker Studios Overnight Films United States of America
Tere Naam, Romance Thriller Satish Kaushik People Tree Films India
The Hedgehog, Comedy Drama Mona Achache France 2 Cinéma Les Films des Tournelles Pathé Eagle Pictures Italy France
Wife! Be Like a Rose!, Drama Mikio Naruse P.C.L. Film Studio Japan
M, Drama Thriller Joseph Losey Superior Pictures United States of America
Doppelganger, Comedy Horror Science Fiction Thriller Kiyoshi Kurosawa Twins Japan Warner Bros. Sato Atsushi Towani Corp. Japan
All Good Things, Drama Mystery Thriller Crime Romance Andrew Jarecki The Weinstein Company United States of America
Black Sheep, Comedy Foreign Oliver Rihs Oliwood Productions koboiFILM Germany
Stalin, Drama History War Ivan Passer Home Box Office (HBO) Novofilm Magyar Televízió Müvelödési Föszerkesztöség (MTV) (I) Russia Hungary
The North Star," Action Adventure Drama Lewis Milestone Samuel Goldwyn Company, The United States of America"
Last Night, Drama Romance Massy Tadjedin Gaumont Nick Wechsler Productions Star Entertainment France United States of America
Russell Peters: Outsourced, Comedy Alan C. Blomquist Warner Bros. United States of America
Message from Space, Action Adventure Science Fiction Kinji Fukasaku United Artists Toei Company Tohokushinsha Film Corporation (TFC) Japan
Christmas Holiday, Drama Crime Robert Siodmak Universal Pictures United States of America
Thirty-Five Something, Comedy Cécile Telerman La Mouche du Coche Films Belgium France
From Prada to Nada, Comedy Drama Romance Angel Gracia Lewis Gilbert Productions Lionsgate Modern VideoFilm United States of America
Tongan Ninja, Action Comedy Foreign Jason Stutter  New Zealand
Client 9: The Rise and Fall of Eliot Spitzer, Documentary Alex Gibney  
Submarino, Drama Thomas Vinterberg Nimbus Film Productions Denmark
Hideaway (Le refuge), Drama François Ozon Le Pacte France
Scooby-Doo! The Mystery Begins,Scooby-Doo Collection Mystery Animation Comedy Fantasy Brian Levant Warner Premiere Canada United States of America
For Love of Ivy, Comedy Drama Romance Daniel Mann Cinerama Productions Corp. Palomar Pictures (I) ABC Pictures International United States of America
Smilin' Through, Drama Romance Sidney Franklin Metro-Goldwyn-Mayer (MGM) United States of America
Casanova Brown, Comedy Sam Wood International Pictures United States of America
Black Bread, Drama Crime Agustí Villaronga Televisió de Catalunya TV3 Massa d'Or Produccions Spain
White Hell of Pitz Palu, Drama G.W. Pabst Arnold Fanck Sokal-Film GmbH Germany
A Good Lawyer's Wife, Drama Crime Im Sang-soo  South Korea
Kill the Irishman, Action Crime Thriller Drama Jonathan Hensleigh Anchor Bay Films Dundee Entertainment Code Entertainment Sweet William Productions United States of America
The Asthenic Syndrome, Drama Kira Muratova Odessa Film Studios Goskino Ukraine
Vääpeli Körmy - Taisteluni,Vääpeli Körmy - Collection  Ere Kokkonen  
Suez, Drama History Romance Allan Dwan Twentieth Century Fox Film Corporation United States of America
Hand Gun, Crime Action Thriller Whitney Ransick Shooting Gallery Odessa Motion Picture Corp. United States of America
The Pelican Man,  Liisa Helminen  
Apart from You, Drama Mikio Naruse Shochiku Company Japan
On the Riviera, Comedy Music Romance Walter Lang Twentieth Century Fox Film Corporation United States of America
Cyberbully, Drama Charles Binamé Muse Entertainment Enterprises Canada
Bolivia, Drama Foreign Adrián Caetano  Argentina Netherlands
The Messengers 2: The Scarecrow,The Messengers Collection Horror Martin Barnewitz Ghost House Pictures United States of America
Boys, Drama Nils Malmros Steen Herdel Filmproduktion EBC Films Denmark
Birdemic: Shock and Terror,Birdemic Collection Horror Science Fiction James Nguyen  United States of America
Contagion, Drama Thriller Science Fiction Steven Soderbergh Double Feature Films Regency Enterprises Warner Bros. Participant Media Imagenation Abu Dhabi FZ United States of America United Arab Emirates
Film Is a Girl & a Gun, Drama Gustav Deutsch  
In Vanda's Room, Drama Pedro Costa Pandora Filmproduktion Instituto Português da Arte Cinematográfica e Audiovisual (IPACA) Contracosta Produções Portugal Switzerland Germany
Ghost from the Machine, Thriller Science Fiction Matt Osterman  
Portrait Werner Herzog, Documentary Werner Herzog Werner Herzog Filmproduktion Germany
Mystics in Bali, Mystery Horror H. Tjut Djalil Video Tape Corp. Pusat Perusahaan Film Australia Indonesia
Blondie Knows Best,Blondie Collection Comedy Abby Berlin  United States of America
American Son, Drama Neil Abramson  
Dream House, Drama Thriller Mystery Jim Sheridan Cliffjack Motion Pictures Morgan Creek Productions Canada United States of America
Election Day,  Katy Chevigny  
The People vs. George Lucas, Documentary Alexandre O. Philippe  
Espion(s), Drama Romance Thriller Nicolas Saada France 2 Cinéma Mars Distribution The Film Studio 37 France United Kingdom
Million Dollar Legs, Comedy Edward F. Cline Paramount Pictures United States of America
The Descendants, Comedy Drama Alexander Payne Fox Searchlight Pictures Dune Entertainment Ad Hominem Enterprises United States of America
The Uninvited, Mystery Drama Horror Larry Shaw  United States of America
À l'aventure, Drama Jean-Claude Brisseau Moby Dick Films Soficinéma 3 La Sorcière Rouge France
Carmen Comes Home, Comedy Keisuke Kinoshita Shochiku Company Japan
Contact High, Comedy Michael Glawogger LOTUS Film GmbH für ORF Austria Germany Luxembourg Poland
The Human Centipede 2 (Full Sequence),The Human Centipede Collection Drama Horror Crime Tom Six Six Entertainment United Kingdom Netherlands
Praise, Drama John Curran Emcee Films Australia
Becoming Chaz, Documentary Fenton Bailey Randy Barbato  
Barbie in the Nutcracker, Animation Family Owen Hurley Rainmaker Entertainment Canada
Safe House, Action Thriller Daniel Espinosa Universal Pictures Dentsu Relativity Media Bluegrass Films United States of America
Resurrect Dead: The Mystery of the Toynbee Tiles, Documentary Jon Foy  
Romantics Anonymous, Drama Comedy Romance Jean-Pierre Améris Angoa-Agicoa Procirep France 3 Cinéma StudioCanal Rhône-Alpes Cinéma Canal+ CinéCinéma Pan-Européenne France Télévision Cinémage 4 Radio Télévision Belge Francophone (RTBF) Climax Films Le Tax Shelter du Gouvernement Fédéral de Belgique Casa Kafka Pictures La Banque Postale Image 3 Centre National de la Cinématographie (CNC) Uni Étoile 7 Media Programme of the European Community Dexia Movie Tax Shelter Empowered by Dexia Belgium France
Silent House, Horror Mystery Chris Kentis Laura Lau Elle Driver Tazora Films France United States of America
Mirror Mirror, Adventure Fantasy Drama Comedy Science Fiction Family Tarsem Singh Relativity Media Misher Films Yucaipa Films Goldmann Pictures Rat Entertainment Misha Films United States of America
Cord, Crime Drama Thriller Sidney J. Furie  Canada
Brave, Animation Adventure Comedy Family Action Fantasy Brenda Chapman Mark Andrews Steve Purcell Walt Disney Pictures Pixar Animation Studios United States of America
Virtual JFK: Vietnam If Kennedy Had Lived,  Koji Masutani  United States of America
The War, Documentary History War Ken Burns Lynn Novick PBS United States of America
Warning from Space, Science Fiction Koji Shima Daiei Studios Japan
The President's Man: A Line in the Sand,The President's Man Collection Thriller Drama Action Eric Norris Norris Brothers Entertainment Washo Brothers Entertainment United States of America
I Am Bruce Lee, Documentary Pete McCormack  Canada United States of America
The Heroine, Action Crime Foreign Chu Mu Great Earth Film Company Hong Kong
Diary of a Wimpy Kid: Dog Days,Diary of a Wimpy Kid Collection Comedy Family David Bowers Fox 2000 Pictures United States of America
That's My Boy, Comedy Sean Anders Columbia Pictures Happy Madison Productions Relativity Media United States of America
The Tall Man, Horror Mystery Thriller Pascal Laugier SND Forecast Pictures Iron Ocean Films Radar Films Canada France
"Goke, Body Snatcher from Hell", Horror Science Fiction Thriller Hajime Sato Shôchiku Eiga Japan
7 Below, Horror Kevin Carraway Efish Entertainment Vitamin A Films Silver Moonlight Productions PalmStar Entertainment Barking Fish Entertainment United States of America
The Cool Ones, Comedy Gene Nelson Warner Bros. William Conrad Productions United States of America
Elia Kazan: A Director's Journey,  Richard Schickel  United States of America
Thirst for Love,  Koreyoshi Kurahara  Japan
Pumping Iron II: The Women,Pumping Iron Collection Documentary   
Victor Seastrom,  Gösta Werner  Sweden
Remember the Day, War Drama Romance Henry King Twentieth Century Fox Film Corporation United States of America
Goal! III : Taking On The World,Goal! Collection Drama Andrew Morahan  
Dangerous Liaisons, Drama Romance Hur Jin-Ho   Huaxia Film Distribution Company China Singapore South Korea
A Holiday Engagement, TV Movie Comedy Romance Jim Fall Johnson Production Group Tim Johnson Productions United States of America
Murder on Flight 502, Drama Action Thriller Mystery George McCowan  United States of America
Storage 24, Horror Science Fiction Johannes Roberts Unstoppable Entertainment Medient Studios Big Yellow Films United Kingdom
Yossi,Yossi Collection Drama Romance Eytan Fox Lama Films United King Films Israel
Filming Othello, Documentary Orson Welles  Germany
"Glenn, the Flying Robot", Science Fiction Fantasy Marc Goldstein Singing Trees Entertainment Belgium
Lucy, TV Movie Drama Glenn A. Jordan  
Parker, Action Crime Taylor Hackford SND United States of America
Désiré, Science Fiction Albert Dupontel  
Who Killed Vincent Chin?, Documentary Renee Tajima-Pena Christine Choy  
Which Way Home, Documentary Rebecca Cammisa HBO 
Heroine, Drama Foreign Madhur Bhandarkar  India
Living in Emergency: Stories of Doctors Without Borders, Documentary   
Phantom, Thriller Todd Robinson Trilogy Entertainment Group RCR Media Group Solar Filmworks United States of America
The Great Gatsby, Drama Elliott Nugent Paramount Pictures United States of America
The Task, Horror Alex Orwell After Dark Films United States of America
The Place Beyond the Pines, Drama Crime Derek Cianfrance Sidney Kimmel Entertainment Electric City Entertainment Verisimilitude United States of America
Battle in Outer Space, Science Fiction Ishirô Honda Toho Company Japan
Disconnect, Drama Thriller Henry Alex Rubin Lionsgate Liddell Entertainment LD Entertainment Wonderful Films PLC Exclusive Media Group United States of America
Scary Movie 5,Scary Movie Collection Comedy Malcolm D. Lee Dimension Films United States of America
