title,features
Living It Up, Comedy Music Norman Taurog Paramount Pictures United States of America
Dhadakebaaz, Comedy Mahesh Kothare  India
Tezaab, Drama N. Chandra  India
Pyaar Kiya To Darna Kya, Comedy Drama Foreign Romance Sohail Khan  
Jis Desh Mein Ganga Rehta Hai, Comedy Drama Family Mahesh Manjrekar Universal Music India
Vanina Vanini, Drama Roberto Rossellini  France Italy
Prem Ratan Dhan Payo, Drama Action Romance Sooraj R. Barjatya Fox Star Studios Rajshri Productions India
No Night Is Too Long, Crime Drama Thriller TV Movie Tom Shankland Alliance Atlantis Communications British Broadcasting Corporation (BBC) Studios Victoria Inc. United Kingdom United States of America
Scarlet Angel, Adventure Drama Western Sidney Salkow Universal International Pictures (UI) United States of America
38 Parrots, Animation Family Ivan Ufimtsev  Russia
Hussar Ballad, Comedy Eldar Ryazanov Mosfilm Russia
Lemonade, Drama Comedy Ali Atay  Turkey
Criminal Activities, Thriller Crime Drama Jackie Earle Haley NeeNee Productions Capacity Pictures May Day Movies United States of America
Hitchcock/Truffaut, Documentary Kent Jones Cohen Media Group United States of America
Schneider vs. Bax, Comedy Thriller Alex van Warmerdam Czar Verenigde Arbeiders Radio Amateurs (VARA) Graniet Film BV Netherlands
Night Wind, Drama Philippe Garrel  France
How to Win at Checkers (Every Time), Drama Josh Kim Chris Lee Productions Add Word Productions Electric Eel Films Hidden Rooster Films Thailand
Saw, Crime Horror Thriller James Wan Twisted Pictures Australia
Angels of Revolution, Romance Drama History Aleksey Fedorchenko Krasnaya Strela Russia
Ostia,  Sergio Citti  Italy
Gone Too Far!, Comedy Destiny Ekaragha Poisson Rouge Pictures BFI Film Fund United Kingdom
"Christmas, Again",  Charles Poekel  
Locust, Crime Drama Thriller Egor Baranov Central Partnership Russia
72 Tenants of Prosperity, Comedy Eric Tsang Patrick Kong Chung Shu-Kai Sil-Metropole Organisation Shaw Brothers United Filmmakers Organization (UFO) Television Broadcasts Limited (TVB) Hong Kong
Steelyard Blues, Drama Comedy Crime Alan Myerson Warner Bros. United States of America
A Fare to Remember, Drama Romance James Yukich  
The Accidental Detective, Comedy Crime Thriller Kim Jung-Hoon CJ Entertainment South Korea
Uuno Turhapuro – kaksoisagentti,Uuno Turhapuro Comedy Spede Pasanen  
Fifty Shades of Black, Romance Comedy Michael Tiddes Open Road Films (II) United States of America
Just in Time for Christmas, Family Fantasy TV Movie Romance Drama Sean McNamara Hallmark Hall of Fame Productions United States of America
Aurore, Drama Action Foreign Luc Dionne  Canada
Bo, Drama Hans Herbots Caviar Films Belgium
Brasserie Romance, Comedy Drama Joël Vanhoebrouck A Private View Belgium
Verlengd Weekend, Comedy Drama Hans Herbots  Belgium
The Son of an Afghan Farmer, Romance Drama Mathew Levin II Pilgrims 7 Corporation United States of America
Riot, Action John Lyde Mainstay Productions United States of America
Rowdy Rathore, Action Prabhu Deva SLB Films Pvt. Ltd. India
Charlie Muffin, Drama Thriller TV Movie Jack Gold Euston Films United Kingdom
General Nil,  Ryszard Bugajski  Poland
Maicol Jecson, Comedy Enrico Audenino Francesco Calabrese  
Deadlier Than the Male, Drama Thriller Julien Duvivier Société Nouvelle Pathé Cinéma Les Films Agiman France
Spanish Lake, Documentary Phillip Andrew Morton  
Soulmate, Horror Mystery Axelle Carolyn Forecast Features United Kingdom
Horse Money, Drama Pedro Costa Sociedade Óptica Técnica Portugal
The Carboard Bernini, Documentary   
Aamdani Atthanni Kharcha Rupaiya, Foreign Comedy Drama K Raghavendra Rao  India
The Thorn, Comedy Peter McWilliams  United States of America
As the Shadow,  Marina Spada  Italy
Wolves of Wall Street, Horror David DeCoteau ACH Regent Productions Christopher Filmcapital United States of America
Beach Spike, Action Tony Tang B&E Productions Hong Kong
Waqt: The Race Against Time, Drama Vipul Amrutlal Shah Blockbuster Movie Entertainers Eros Entertainment Entertainment One India
Story of Night, Documentary Clemens Klopfenstein Zweites Deutsches Fernsehen (ZDF) Institut National de l'Audiovisuel (INA) Schweizerische Radio- und Fernsehgesellschaft (SRG) Ombra-Film Germany Switzerland France
Revue, History Documentary Foreign Sergey Loznitsa  
RR, Documentary James Benning  Germany United States of America
A Humble Life, Fantasy Documentary Science Fiction Family Alexander Sokurov  Japan Russia
Insiang, Drama Lino Brocka Cinemanila Philippines
The Box,  Kanji Nakajima  Japan
Fallen, Drama Fred Kelemen Kino Kombat Screen Vision Latvia Germany
The Scarlet Flower, Family Fantasy Romance Irina Povolotskaya Gorky Film Studio Russia
Screaming Masterpiece, Documentary Ari Alexander Ergis Magnússon Zik Zak Kvikmyndir Ergis Filmproduction Iceland Denmark Netherlands
"Iracema, Uma Transa Amazônica", Drama Jorge Bodanzky Orlando Senna  Brazil
The Clan - Tale of the Frogs, Action Drama Crime Comedy Romance Mika Kaurismäki  Finland
Mods, Music Drama Serge Bozon Elena Films France
Pokiri, Action Foreign Thriller Puri Jagannath Vaishno Academy Indira Productions India
The Stoneman Murders,  Manish Gupta  
Ora o mai più, Comedy Lucio Pellegrini  
The King's Beard, Animation Family Adventure Tony Collingwood  United Kingdom
Little Blond Death, Drama Jean van de Velde Verenigde Nederlandsche Filmcompagnie (VNF) Netherlands
Shock Head Soul, Documentary Simon Pummell Hot Property Films Illuminations Films Submarine Netherlands United Kingdom
Plastic Jesus, Drama Lazar Stojanović Centar Film Serbia
Szaffi, Animation Attila Dargay  Hungary
Mermaid, Animation Fantasy Aleksandr Petrov Dago Productions Russia
Oosaravelli, Action Romance Foreign Surendra Reddy Sri Venkateswara Cine Chitra India
The Office Wife, Drama Romance Lloyd Bacon Warner Bros. United States of America
Jare vs. Cheek, TV Movie Documentary Music   
Arundhati, Horror Fantasy Thriller Kodi Rama Krishna  India
Two Faces of the Dollar, Western Roberto Bianchi Montero Les Films du Griffon Tigielle 33 France Italy
Force,Force Collection Drama Action Thriller Crime Romance Nishikant Kamat  
Prologue, Action Animation Richard Williams  
A More Perfect Union, Documentary History   
Shana: The Wolf's Music, Adventure Drama Music Nino Jacusso Really Real Films Canada Switzerland
Brian Eno: Another Green World, Documentary Music Nicola Roberts  
The Mark of the Whistler,The Whistler collection Thriller William Castle Larry Darmour Productions United States of America
Island of Death, Horror Thriller Nico Mastorakis Omega Pictures Greece
The Garden of Sinners: Future Gospel,The Garden of Sinners Animation Science Fiction Tomonori Sudou ufotable TYPE-MOON Japan
Fan, Action Drama Thriller Maneesh Sharma Red Chillies Entertainment India
Pretty Ugly People, Comedy Tate Taylor  United States of America
The game of truth, Drama Comedy Romance Foreign Álvaro Fernández Armero Morena Films De Palacio Films Spain
Disney's Very Merry Christmas Sing Along Songs, Music Animation  Walt Disney Studios Home Entertainment 
The Choice, Drama Romance Ross Katz Lionsgate Nicholas Sparks Productions United States of America
Moonshine County Express, Action Crime Drama Gus Trikonis New World Pictures Universal Majestic Inc. United States of America
At the End of the Tunnel, Crime Thriller Rodrigo Grande Haddock Films S.R.L. Televisión Española (TVE) Telefé International Tornasol Films S.A. Árbol Contenidos Spain Argentina
Citizen, Drama Action Crime Foreign Saravana Subbiah Nic Arts India
Santa Claus, Comedy Alexandre Coffre Mars Distribution France
Daughter... Father... Daughter,    
Spiral Jetty, Documentary Robert Smithson  
Noma: My Perfect Storm, Documentary Pierre Deschamps  United Kingdom
Gourmet Club, Comedy Juha Wuolijoki  Finland
Gascoigne, Documentary Jane Preston Salon Pictures United Kingdom
Port of Call, Crime Thriller Philip Yung Mei Ah Films Production Co. Ltd. Hong Kong
Skinning, Action Crime Drama Stevan Filipović Hypnopolis Serbia
Deathlands, Science Fiction   
All of My Heart,All of My Heart Collection Romance TV Movie Peter DeLuise The Hallmark Channel 
One Starry Christmas, Romance John Bradshaw  Canada
Adolf Hitler: The Greatest Story Never Told, Documentary History Dennis Wise TruthWillOut Films 
Annie's Point, Drama Family Michael Switzer Larry Levinson Productions United States of America
Ali Wong: Baby Cobra, Comedy Jay Karas New Wave Entertainment United States of America
High Tide,  Oddvar Einarson  
Beyond Sleep, Drama Boudewijn Koole  
Bye Bye Blue Bird, Comedy Drama Katrin Ottarsdóttir  
Daughter of Darkness, Thriller Lance Comfort Alliance Productions Victor Hanbury Productions United Kingdom
Complete Unknown, Drama Mystery Thriller Joshua Marston Parts and Labor Great Point Media Heron Television United States of America
Angels One Five, Drama War George More O'Ferrall Associated British Picture Corporation (ABPC) Templar Film Studios United Kingdom
No Man's Woman, Crime Franklin Adreon Republic Pictures (I) United States of America
Womanlight, Drama Costa-Gavras Corona Cinematografica Opera Film France
Hail! Mafia, Thriller Crime Drama Raoul Lévy  
El patrullero 777, Comedy Miguel M. Delgado Rioma Films Mexico
"You, Me and Him", Drama Daniel Ribeiro  Brazil
Living in the Age of Airplanes, Documentary Brian J. Terwilliger Terwilliger Productions United States of America
The Lost Valentine, TV Movie Romance Drama Darnell Martin Hallmark Hall of Fame Productions United States of America
Curse of the Crimson Altar, Horror Mystery Vernon Sewell Tigon British Film Productions United Kingdom
Schmitke, Comedy Drama Stepan Altrichter  Czech Republic Germany
The Love Witch, Comedy Fantasy Horror Romance Anna Biller Anna Biller Productions United States of America
Kingsglaive: Final Fantasy XV,Final Fantasy Collection Action Animation Adventure Drama Fantasy Science Fiction Takeshi Nozue Square Enix Digic Pictures Image Engine Design Japan United States of America
Sorry for the Disturbance, Comedy Drama Mystery Khaled Marei  Egypt
Jaco, Music Documentary Paul Marchand Stephen Kijak  
Prince Among Slaves, Documentary Bill Duke Andrea Kalin Spark Media Unity Productions Foundation United States of America
Exit Speed, Action Thriller Scott Ziehl Sabbatical Pictures United States of America
Swingers, Romance Drama Stephan Brenninkmeijer BrennFilm Rebel Film BV Netherlands
Road to Kabul, Comedy Action Brahim Chkiri  Morocco
Love Finds A Home,The Love Comes Softly Collection Drama Action Western Family David S. Cass Sr.  United States of America
A Stand Up Guy, Comedy Mike Young 2B Films United States of America
Rustom, Thriller Romance Tinu Suresh Desai KriArj Entertainment India
The Accountant, Crime Thriller Drama Gavin O'Connor Zero Gravity Management Warner Bros. Electric City Entertainment RatPac-Dune Entertainment United States of America
League of Gods, Action Fantasy Koan Hui On Distant Horizons China Star Entertainment Huayi Brothers China Hong Kong
1st to Die, Action Thriller Russell Mulcahy  
Steel Frontier, Action Science Fiction Paul G. Volk Joe Hart PM Entertainment Group United States of America
Horses of God, Drama Nabil Ayouch Jamal Belmahi Ali'n Productions France Morocco
The Best of Insomniac with Dave Attell Volume 1, Comedy  Comedy Central United States of America
Street Fighter IV: The Ties That Bind,Street Fighter Collection Action Animation Jirô Kanai Studio 4°C Japan
Killjoy, Mystery Thriller John Llewellyn Moxey  
Star Spangled Rhythm, Comedy Music George Marshall Paramount Pictures United States of America
"Joshua Tree, 1951: A Portrait of James Dean", Drama Matthew Mishory Jay-X Entertainment Iconoclastic Features United States of America
I'll Sleep When I'm Dead, Documentary Justin Krook  
The Work and the Glory III: A House Divided,The Work and the Glory Collection Drama Sterling Van Wagenen  United States of America
Paranormal Entity,Paranormal Investigations Collection Horror Mystery Thriller Shane Van Dyke The Asylum United States of America
In-Lawfully Yours, Romance Robert Kirbyson Home Theater Films United States of America
Two-Legged Horse, Drama Foreign Samira Makhmalbaf Wild Bunch Makhmalbaf Productions Iran France
Kick the Moon, Comedy Drama Kim Sang-jin  South Korea
The White King, Drama Science Fiction Alex Helfrecht Jörg Tittel Proton Cinema Oiffy Hungary United Kingdom
45365, Documentary Bill Ross IV Turner Ross  
Operator, Comedy Drama Logan Kibens Cruze & Company United States of America
Merry In-Laws, Comedy Fantasy Leslie Hope Johnson Production Group Nomadic Pictures Canada
It's All Good, Comedy Aaron Fronk FND Films United States of America
Trading Christmas, TV Movie Family Michael Scott Front Street Pictures Trade Street Productions Canada United States of America
Cinderella, Fantasy Horror Science Fiction Family Georges Méliès Star-Film Georges Méliès France
Joe Rogan: Triggered, Comedy Anthony Giordano Talking Monkey Netflix United States of America
Ο Θανάσης στη χώρα της σφαλιάρας,  Panos Glykofrydis Dinos Katsouridis  
Hollywood Without Make-Up, Documentary  Filmaster Incorporated United States of America
Almost Christmas, Comedy Drama David E. Talbert Universal Pictures Will Packer Productions United States of America
Jeff Ross Roasts Cops, Comedy   
Outlaw: Kill!,Outlaw Gangster VIP: The Complete Collection Foreign Crime Action Thriller Keiichi Ozawa Nikkatsu Japan
Christmas with Holly, Drama Family Allan Arkush Hallmark Hall of Fame Productions United States of America Canada
Allerleirauh, Family Fantasy Christian Theede ARD NDR Germany
The Sea Around Us, Documentary Irwin Allen RKO Radio Pictures Irwin Allen Productions United States of America
Siren, Horror Gregg Bishop Chiller Films Blue Falcon Productions Big Picture Casting United States of America
The Space Between Us, Romance Adventure Science Fiction Drama Peter Chelsom Southpaw Entertainment STX Entertainment Los Angeles Media Fund (LAMF) United States of America
Opening Night, Comedy Music Isaac Rentz Dark Factory Entertainment United States of America
Happy Wedding, Comedy Drama Romance Omar Lulu Eros International India
I Can Make You Love Me, Thriller Michael Switzer Leonard Hill Films Frank Abatemarco Productions United States of America
Three Heroes and Julius Caesar,Three Heroes Collection Adventure Animation Comedy Fantasy Konstantin Feoktistov Melnitsa Animation Studio Russia
King for a Day, Comedy Nikolai Volev Boyana Film Bulgaria
Mercy, Thriller Chris Sparling XYZ Films Netflix 
Under the Sea 3D, Documentary Howard Hall Warner Bros. Imax Filmed Entertainment Howard Hall Productions Canada United States of America
Overdose,El pico - Colección Drama Eloy de la Iglesia Ópalo Films Spain
Say 'I Love You', Drama Romance Asako Hyuga Shochiku Japan
María (y los demás), Comedy Drama Nely Reguera Friday Films Spain
Shadow of the Wolf, Drama Adventure Jacques Dorfmann  France Canada
I Am Femen, Documentary Alain Margot  Switzerland
The Twelve Gold Medallions, Action Drama Foreign Cheng Kang Shaw Brothers Hong Kong
Sleepless, Action Crime Thriller Baran bo Odar Vertigo Entertainment FilmNation Entertainment Open Road Films (II) Riverstone Pictures United States of America
All We Had, Drama Katie Holmes Mustard & Co Straight Shot Films Jaro/Noelle Production United States of America
Eddie Griffin: You Can Tell 'Em I Said It, Comedy Jay Karas  United States of America
Purgatory, Horror Mystery Pau Teixidor  Spain
Special Delivery,  John Weldon Eunice Macaulay  Canada
Vipers Nest, Drama Will Koopman Independent Films Netherlands France
Boo! A Madea Halloween, Comedy Horror Tyler Perry Lionsgate The Tyler Perry Company United States of America
The Stolen Years, Romance Barbara Wong Chun-Chun China Movie Channel Beijing New Film Association China
Curumim, Documentary Marcos Prado  
Journey To Greenland, Drama Comedy Sébastien Betbeder UFO Envie de tempête Productions Bobi Lux France
Hickey, Comedy Alex Grossman Nut Bucket Films Maxine Street Productions United States of America
The Happy Film, Documentary Stefan Sagmeister Ben Nabors Hillman Curtis  
Eternal Summer, Drama Romance Leste Chen Three Dots Entertainment Company Flash Forward Entertainment Rolling Film Entertainment Taiwan
Berlin Syndrome, Mystery Thriller Drama Horror Cate Shortland Screen Australia Memento Films International Film Victoria Aquarius Films Fulcrum Media Finance DDP Studios Photoplay Films Australia
They Nest, Science Fiction Horror Ellory Elkayem The Kushner-Locke Company United States of America
Tony Roberts: Motorcity Motormouth, Comedy Elijah Dylan Costa  United States of America
Fist of the North Star: Legend of Yuria,Fist of the North Star: The Legends of the True Savior Action Animation Hidehito Ueda TMS Japan
Joe Rogan: Rocky Mountain High, Comedy Ryan Polito Talking Monkey United States of America
Across the Waters, Drama History War Nicolo Donato  Denmark
Donald Cried, Drama Comedy Kris Avedisian Rough House Pictures How follows what Electric Chinoland Ramo Law United States of America
The Railroad Lady, Comedy Drama Timo von Gunten Jacques à Bâle Pictures Switzerland
Tess of the D'Urbervilles, Drama David Blair British Broadcasting Corporation (BBC) WGBH BBC Drama Productions United Kingdom United States of America
Killer Nun, Drama Horror Thriller Giulio Berruti Cinesud Italy
Power Rangers, Action Adventure Science Fiction Dean Israelite Lionsgate Saban Brands United States of America Canada
Rainer Werner Fassbinder's World on a Wire: Looking Ahead to Today, Documentary Juliane Lorenz Rainer Werner Fassbinder Foundation Germany
Casting JonBenet, Documentary Kitty Green Forensic Films Meridian Productions Symbolic Entertainment United States of America
Sami Blood, Drama Amanda Kernell Bautafilm Nordisk Film Production Sverige AB Denmark Norway Sweden
That's Not Us, Drama William Sullivan  United States of America
My Little Princess, Drama Eva Ionesco France 2 Cinéma Les Productions Bagheera Canal+ France Télévision France
Amphibian Man, Adventure Science Fiction Romance Vladimir Chebotaryov Gennadi Kazansky Goskino Productions Russia
The Collector, Drama Thriller Auli Mantila Gnu Films Finland
The Wild Women of Wongo, Adventure Comedy Fantasy James L. Wolcott  United States of America
Looking for Light: Jane Bown, Documentary Luke Dodd Michael Whyte Hot Property Films United Kingdom
Poppy, Comedy A. Edward Sutherland  United States of America
Revenge of the Creature,Creature From The Black Lagoon (Universal Series) Horror Science Fiction Jack Arnold Universal International Pictures (UI) United States of America
InAlienable, Action Adventure Comedy Science Fiction Thriller Robert Dyke  United States of America
Paul Mooney: Analyzing White America, Comedy   United States of America
Nuvvostanante Nenoddantana, Drama Comedy Romance Foreign Prabhu Deva  
Dolly Parton's Christmas of Many Colors: Circle of Love, Drama Family Stephen Herek  
Dr. Monica, Drama William Keighley Warner Bros. United States of America
The Dawns Here Are Quiet, Drama War Renat Davletyarov Star Media Интерфест Реал-Дакота Russia
Dusk, Drama Thriller Michael Maney Dog Day Films United States of America
Cloud Heaven,Облако-рай (Коллекция) Comedy Drama Nikolai Dostal  Russia
Ismael's Ghosts, Drama Romance Thriller Arnaud Desplechin Why Not Productions France
Life Cycles, Documentary Derek Frankowski  Canada
Sea Monsters: A Prehistoric Adventure, Documentary Sean MacLeod Phillips  United States of America
Vacations in Prostokvashino,Prostokvashino Collection Animation Vladimir Popov  Russia
Bummer 2,Bummer Collection Action Crime Pyotr Buslov CTB Film Company Pygmalion Production Russia
Evil Angel, Horror Thriller Richard Dutcher  United States of America
Cat in the Brain, Comedy Horror Lucio Fulci Executive Cine TV Italy
In Search of Ancient Astronauts, Documentary Harald Reinl  
Teen-Age Strangler, Horror Thriller Ben Parker Ajay Film Company United States of America
The Dead Talk Back, Horror Merle S. Gould Headliner Productions United States of America
Mohamed Dubois, Comedy Ernesto Ona Wild Bunch Les Films Manuel Munz France
Becoming Bond, Documentary Comedy Josh Greenbaum  
In View,  Ciaran Creagh  
Shadow World, Documentary Johan Grimonprez  
The Toth Family, Drama War Comedy Zoltán Fábri MAFILM Stúdió 1 Hungary
Abigél, Drama Éva Zsurzs  
Metalocalypse: The Doomstar Requiem, Animation Music Comedy Drama Mark Brooks Adult Swim United States of America
Gamer, Action Thriller Science Fiction Foreign Patrick Levis  France
Anna Karenina, Drama Romance Julien Duvivier London Film Productions United Kingdom
Love Hotel,  Shinji Sômai  Japan
Ехали в трамвае Ильф и Петров, Comedy Viktor Titov  Russia
That Thing Called Tadhana, Romance Antoinette Jadaone Cinema One Originals Monoxide Works Epicmedia Philippines
The Wearing of the Grin, Animation Chuck Jones  
Gymnasium Exercises and Drill at Newport Training School,  James H. White  
American Burger, Comedy Johan Bromander  Sweden
Scandalous John, Western Comedy Drama Family Robert Butler  
Mama's Dirty Girls, Thriller Crime John Hayes  United States of America
Mickey's House of Villains, Animation Family Jamie Mitchell  United States of America
Unresolved Sexual Tension, Comedy Romance Miguel Ángel Lamata  Spain
Once More,  Paul Vecchiali  
Totò Sceicco,Totò Collection Comedy Mario Mattoli Titanus Italy
Jesus,The Bible Collection History Drama Roger Young Five Mile River Films Beta Film CBS Television Lux Vide Česká televize Czech Republic Germany Italy United States of America
Joshua: Teenager vs. Superpower, Documentary Joe Piscatella  
Independents' Day," Action Science Fiction Laura Beth Love Asylum, The Slightly Distorted Productions United States of America"
The Emoji Movie, Comedy Family Animation Anthony Leondis Columbia Pictures Sony Pictures Animation United States of America
The Hope Factory,  Natalya Meshchaninova  
Pairon Talle,  Sidharth Srinivasan  
Der Herr Karl, Comedy  Österreichischer Rundfunk (ORF) Austria
Hydrozagadka, Crime Comedy Andrzej Kondratiuk  Poland
Possibility of an Island, Science Fiction Action Michel Houellebecq Mandarin Films France Germany Spain
Up 'n' Under, Comedy John Godber  
Altar of Fire, Documentary Robert Gardner  
The Man with the Rubber Head, Comedy Fantasy Science Fiction Georges Méliès Star Film Company France
The Living Playing Cards, Fantasy Georges Méliès Star-Film France
Deep Hearts, Documentary Robert Gardner  United States of America
Shadow of the Blair Witch, Mystery Horror Ben Rock  
