title,features
Airspeed, Adventure Action Robert Tinnell Melenny Productions The Government of Canada Income Tax Credit Program United States of America Canada
The Little Thief, Romance Drama Crime Claude Miller Orly Films France
Night at the Crossroads, Mystery Crime Drama Jean Renoir Europa Films France
Somebody Up There Likes Me, Comedy Bob Byington  
Come Out and Play, Horror Makinov Canana Films Videocine S.A. de C.V. Mexico
No and Me, Drama Zabou Breitman Centre National de la Cinématographie Procirep France 3 Cinéma Epithète Films France Télévision Soficinéma 6 Orange Cinéma Séries La Banque Postale Image 3 France
Fullmetal Alchemist: The Sacred Star of Milos,Fullmetal Alchemist Collection Adventure Fantasy Animation Action Science Fiction Kazuya Murata Tokyo Broadcasting System (TBS) Aniplex Mainichi Broadcasting System (MBS) FUNimation Entertainment Shochiku Company Dentsu Square Enix Bones Japan
The Heat, Action Comedy Crime Paul Feig Ingenious Film Partners Ingenious Media Twentieth Century Fox Film Corporation Chernin Entertainment Big Screen Productions TSG Entertainment United States of America
The Terror Within, Horror Science Fiction Thierry Notz Concorde Pictures United States of America
The Canyons, Thriller Drama Paul Schrader Filmworks/FX Prettybird Post Empire Films Sodium Fox United States of America
The Second Arrival,The Arrival Collection Action Adventure Science Fiction Thriller Kevin Tenney Rootbeer Films Taurus 7 Film Corporation 
Creature with the Atom Brain, Crime Horror Science Fiction Thriller Edward L. Cahn Clover Productions United States of America
Money Matters, Drama Ryan Richmond  United States of America
Enter Nowhere, Mystery Science Fiction Thriller Jack Heller Caliber Media Company United States of America
Journey to Portugal, Romance Drama Sérgio Tréfaut  Portugal
The Little Traitor, Drama Lynn Roth  
Joy of Sex, Comedy Romance Martha Coolidge Paramount Pictures Cinema Group Ventures United States of America
Paradise: Faith,Paradise Trilogy Drama Ulrich Seidl  Austria Germany France
A Gathering of Old Men, Drama Volker Schlöndorff  United States of America
On the Job, Action Crime Erik Matti ABS-CBN Film Productions Star Cinema Productions XYZ Films Reality Entertainment Philippines
Calling Dr. Death,Inner Sanctum mysteries Thriller Mystery Reginald Le Borg Universal Pictures United States of America
Sunshine on Leith, Music Romance Comedy Drama Dexter Fletcher DNA Films United Kingdom
Deep Dark Canyon, Action Drama Thriller Abe Levy Silver Tree Colorfast Pictures Secret Identity Productions United States of America
TWA Flight 800, Documentary Kristina Borjesson Epix United States of America
Amber Alert, Horror Mystery Thriller Kerry Bellessa Underground Films\ United States of America
Painless, Horror Mystery Fantasy Thriller Juan Carlos Medina Ibermedia Eurimages Canal+ Cofimage Generalitat de Catalunya - Institut Català de les Indústries Culturals (ICIC) Fado Filmes Roxbury Pictures Tobina Film Les Films d'Antoine Instituto de la Cinematografía y de las Artes Audiovisuales (ICAA) A Contracorriente Films France Portugal Spain
Chasing Ghosts: Beyond the Arcade, Documentary Lincoln Ruchti  United States of America
The Flight That Disappeared, Science Fiction Thriller Reginald Le Borg Robert E. Kent Productions United States of America
Once Upon a Scoundrel,  George Schaefer  United States of America Mexico
Tim's Vermeer, Documentary Teller High Delft Pictures United States of America
La rabbia,  Pier Paolo Pasolini Giovanni Guareschi  Italy
Midnight Clear, Drama Dallas Jenkins Jenkins Entertainment United States of America
As Cool as I Am, Comedy Drama Max Mayer Identity Films Wind Dancer Productions United States of America
White Fang,Zanna Bianca Collection Western Adventure Family Lucio Fulci Les Productions Fox Europa Oceania Produzioni Internazionali Cinematografiche In-Cine Compañía Industrial Cinematográfica France Italy Spain
The Dungeon Masters, Documentary Keven McAlester  
At Berkeley, Documentary Frederick Wiseman  
The Square, Documentary Drama History Jehane Noujaim Roast Beef Productions Worldview Entertainment Noujaim Films United Kingdom United States of America Egypt
Intern Academy, Comedy Dave Thomas Minds Eye Entertainment Studio Entertainment Entersport Holdings Maple & Palm Productions Canada
A Single Shot, Drama Crime Thriller David M. Rosenthal Unified Pictures Bron Studios Demarest Films Unanimous Pictures United Kingdom United States of America Canada
Το Ξύλο Βγήκε Από Τον Παράδεισο, Comedy Alekos Sakellarios Finos Film Greece
Zincirbozan,  Atıl Inaç  Turkey
Beyond the Law, Western Giorgio Stegani Roxy Film Sancrosiap Germany Italy Monaco
Better Living Through Chemistry, Drama Comedy Geoff Moore David Posamentier Aegis Film Fund Altus Productions Ealing Metro International Occupant Entertainment United Kingdom United States of America
William Kunstler Disturbing the Universe, Documentary Emily Kunstler Sarah Kunstler Off Center Media United States of America
Informant, Drama Comedy Thriller Documentary Jamie Meltzer  
Wrinkles, Animation Drama Comedy Ignacio Ferreras Cromosoma TV produccions Elephant in the Black Box Perro Verde Films Spain
In Fear, Thriller Jeremy Lovering Big Talk Productions Film4 Anton Capital Entertainment (ACE) United Kingdom
Bad Country, Drama Action Crime Chris Brinker Mandalay Vision ANA Media CB Productions Wilmor Entertainment United States of America
Special Correspondents, Comedy Frédéric Auburtin Les Films Manuel Munz EuropaCorp. France
Meth,  Todd Ahlberg  United States of America
My Mom Is a Character,My Mom is a Character Collection Comedy André Pellenz Globo Filmes Paris Filmes Migdal Filmes Telecine Productions Cenoura Filmes Brazil
Policewomen, Drama Action Crime Lee Frost Saber Productions United States of America
Boca, Action Crime Drama Flávio Frederico  Brazil
O. Henry's Full House, Comedy Drama Henry Hathaway Howard Hawks Henry King Henry Koster Jean Negulesco Twentieth Century Fox Film Corporation United States of America
Lovin' Molly, Romance Drama Sidney Lumet Columbia Pictures Corporation 
Heaven is for Real, Drama Randall Wallace TriStar Pictures Screen Gems Roth Films United States of America
Mondo Hollywood, Documentary Robert Carl Cohen Omega-Cyrano Productions United States of America
Le Week-End, Comedy Drama Roger Michell Le Bureau Film4 Free Range Films France United Kingdom
All About the Feathers, Comedy Neto Villalobos Sucia Centroamericana Producciones Costa Rica
Broadway Rhythm, Family Music Roy Del Ruth Metro-Goldwyn-Mayer (MGM) United States of America
The Rocket, Drama Kim Mordaunt Red Lamp Films Australia Lao People's Democratic Republic Thailand
Ambushed, Action Crime Drama Giorgio Serafini Hollywood Media Bridge Anchor Bay Films Voltage pictures Creamovies Picture Perfect Corp. United States of America
Bettie Page Reveals All, Documentary Mark Mori Single Spark Pictures Music Box Films United States of America
Brooklyn Dodgers: The Ghosts of Flatbush,    
Coming Home, Drama Zhang Yimou LeVision Pictures China
Ju-on: The Beginning of the End,Ju-on Collection Horror Masayuki Ochiai  Japan
Video Games: The Movie, History Documentary Animation Jeremy Snead Mediajuice Studios United States of America
Abby, Horror William Girdler  
Ambush, Action Adventure Foreign Ho Meng-Hua Shaw Brothers 
My way to Olympia, Documentary Niko von Glasow  Germany
Angry Video Game Nerd: The Movie, Science Fiction Adventure Comedy James D. Rolfe Kevin Finn Cinemassacre United States of America
House of Women, Crime Drama Walter Doniger Warner Bros. United States of America
White Bird in a Blizzard, Thriller Drama Gregg Araki Why Not Productions Wild Bunch Desperate Pictures Orange Studios United States of America France
"Park Avenue: Money, Power & The American Dream", Documentary Alex Gibney Jigsaw Productions Steps International 
Junkopia,  Chris Marker Frank Simeone John Chapman Argos Films France
Dracula Untold, Horror Action Drama Fantasy War Gary Shore Universal Pictures Legendary Pictures Fuji Television Network Dentsu Michael De Luca Productions United States of America
What We Do in the Shadows, Comedy Horror Taika Waititi Jemaine Clement Unison Films Defender Films Funny or Die New Zealand
Amazon Jack 3: Jungo Goes Bananas,Jungledyret Hugo Collection Animation Comedy Family Flemming Quist Møller Jørgen Lerdam  
The Swan Princess: The Mystery of the Enchanted Kingdom,Swan Princess Series Fantasy Animation Family Richard Rich NEST Family Entertainment United States of America
A Star for Two, Romance Drama Jim Kaufman  Canada France
Charlotte's Web 2: Wilbur's Great Adventure,Charlotte's Web Collection Adventure Animation Drama Family Mario Piluso Paramount Pictures Universal Pictures Nickelodeon Network Paramount Animation United States of America
Wyatt Earp's Revenge, Drama Action Adventure Michael Feifer  United States of America
Foxcatcher, Drama Thriller Bennett Miller Likely Story Media Rights Capital Annapurna Pictures United States of America
Personal Property, Comedy Romance W.S. Van Dyke  United States of America
Sniper: Legacy,Sniper Collection Thriller Action Don Michael Paul Destination Films BUFO United States of America
Curandero, Horror Eduardo Rodríguez Dimension Films United States of America Mexico
Air Raid Wardens, Comedy Family Edward Sedgwick Metro-Goldwyn-Mayer (MGM) United States of America
Building the Inferno: Nobuo Nakagawa and the Making of 'Jigoku', Documentary   United States of America
The Dark Past, Drama Thriller Crime Rudolph Maté Columbia Pictures Corporation United States of America
Stromberg - Der Film, Comedy Arne Feldhusen Filmstiftung NRW FFA Filmförderungsanstalt Deutsche Filmförderfonds (DFFF) Germany
7eventy 5ive, Horror Thriller Brian Hooks Deon Taylor Hooks and Taylor Entertainment United States of America
Deadline, Documentary Kirsten Johnson Katy Chevigny  
Babysitting,Babysitting Comedy Philippe Lacheau Nicolas Benamou Universal Pictures International (UPI) Axel Films Cinéfrance 1888 La Banque Postale Image 7 Good Lap Production Madame Films France
Lucky Them, Drama Megan Griffiths  United States of America
Ragnarok, Action Adventure Mikkel Brænne Sandemose Fantefilm Film i Väst Ghost VFX Norway
Alien Nation: Millennium,Alien Nation Collection Science Fiction Kenneth Johnson 20th Century Fox Television National Studios Inc. United States of America
The Wall, Action Crime Drama Yash Chopra Trimurti Films Pvt. Ltd. India
Drive Thru, Comedy Horror Brendan Cowles Shane Kuhn Lions Gate Films United States of America
The Fearmakers, Drama Action Thriller Jacques Tourneur Pacemaker United States of America
The Voices, Comedy Crime Horror Thriller Marjane Satrapi Studio Babelsberg Mandalay Vision 1984 Private Defense Contractors Germany United States of America
Tenchi: The Samurai Astronomer, Drama History Yojiro Takita Kadokawa Pictures Japan
Travel Beyond the Three Seas, Adventure History Vasili Pronin Khwaja Ahmad Abbas Mosfilm Naya Sansar Soviet Union India
The Devil and Holy Water,  Bruno Corbucci  Italy
Independents, Documentary Chris Brandt  
Alive or Preferably Dead, Action Comedy Western Duccio Tessari Hesperia Films S.A. Ultra Film - Sicila Cinematografica Italy Spain
Action Jackson, Action Comedy Drama Romance Thriller Prabhu Deva Eros International Austria India
Scooby-Doo! and the Witch's Ghost, Animation Comedy Jim Stenstrum Hanna-Barbera Productions United States of America
The Nativity, Drama History Family Bernard L. Kowalski 20th Century Fox Television D'Angelo-Bullock-Allen Productions United States of America
Bad Karma, Horror Alex Chandon  United Kingdom
Demon Hunter, Horror Scott Ziehl  United States of America
Everyday Sunshine:  The Story of Fishbone, Documentary Music Chris Metzler Lev Anderson  
The 7th Floor, Thriller Patxi Amézcua Telecinco Cinema Ikiru Films El Toro Productions Spain Argentina
Exit Smiling, Comedy Sam Taylor Metro-Goldwyn-Mayer (MGM) United States of America
Crazy for Christmas, Drama Romance Eleanor Lindo  Canada
Jauja, Western Drama Lisandro Alonso Mantarraya Producciones Les films du Worso Massive 4L Kamoli Films Argentina Netherlands Denmark France Mexico United States of America Germany Brazil
Frank & Jesse, Action Adventure Drama Western Robert Boris Trimark Pictures United States of America
Zenobia, Comedy Gordon Douglas Hal Roach Studios United States of America
Blackhat, Crime Drama Mystery Michael Mann Universal Pictures Forward Pass Legendary Pictures United States of America
Terminator Genisys,The Terminator Collection Science Fiction Action Thriller Adventure Alan Taylor Paramount Pictures Annapurna Pictures Skydance Media United States of America
Fear, Thriller Roberto Rossellini Minerva Film SpA Germany Italy
Battle of the Amazons, Fantasy Action Alfonso Brescia Cinematográfica Pelimex Roas Produzioni Spain Italy
Perkins' 14, Horror Thriller Craig Singer After Dark Films United States of America
The Reptile, Horror John Gilling Hammer Film Productions United Kingdom
Tooth Fairy 2,Tooth Fairy Collection Comedy Family Alex Zamm 20th Century Pictures United States of America
Dirkie - Lost in the Desert, Adventure Drama Jamie Uys  
The Deadly Bees, Horror Foreign Thriller Mystery Freddie Francis Paramount Pictures Amicus Productions United Kingdom
The Last Flight, Drama William Dieterle First National Pictures United States of America
Clear History, Comedy Greg Mottola Fox Searchlight Pictures HBO Films United States of America
Talk About a Stranger, Mystery Drama David Bradley Metro-Goldwyn-Mayer (MGM) United States of America
The Expedition to the End of the World, Documentary Daniel Dencik  
Once Fallen, Drama Action Crime Ash Adams Freedom Films Emmett/Furla Films Bravado Pictures United States of America
I Accuse, Horror War Abel Gance  
His and Hers, Drama Comedy Daniel Lind Lagerlöf  Sweden
The Shanghai Cobra,Charlie Chan (Sidney Toler) Collection Mystery Thriller Phil Karlson Monogram Pictures United States of America
Love Bites, Horror Romance Comedy Malcolm Marmorstein  
The Crowded Sky, Action Adventure Drama Joseph Pevney Warner Bros. United States of America
Multiple Sarcasms, Drama Romance Brooks Branch Multiple Avenue Releasing United States of America
The Lovers, Romance Drama Family Fantasy Tsui Hark  Hong Kong
Woman Wanted, Drama Romance Kiefer Sutherland Alan Smithee Woman Wanted Productions Ltd. Phoenician Entertainment United States of America
Soul Power, Documentary Music Jeffrey Kusama-Hinte Antidote Films (I) United States of America
The Last Rites of Ransom Pride, Action Drama Western Tiller Russell Horsethief Pictures Canada
Way Way Out, Comedy Science Fiction Gordon Douglas Coldwater Way Out Company United States of America
Bunny Drop, Drama Comedy SABU Showgate Japan
Fifty Shades of Grey,Fifty Shades Collection Drama Romance Thriller Sam Taylor-Johnson Focus Features Trigger Street Productions Michael De Luca Productions United States of America
The Horribly Slow Murderer with the Extremely Inefficient Weapon, Comedy Horror Richard Gale Chaotic Rampage American Pictures United States of America
Long Hello and Short Goodbye, Comedy Thriller Rainer Kaufmann Studio Hamburg Letterbox Filmproduktion Germany
Li'l Quinquin, Mystery Comedy Crime Bruno Dumont Arte France CNC 3B Productions Région Nord-Pas-de-Calais Le Fresnoy Studio National des Arts Contemporains TV5 Monde Cofinova 10 Pictanovo Nord-Pas-de-Calais France
The Story of Film: An Odyssey, Documentary Mark Cousins  United Kingdom
Neverwhere,  Dewi Humphreys  
The Well, Drama Russell Rouse Cardinal Pictures (II) United States of America
One Way Boogie Woogie,  James Benning  
The Devil with Seven Faces, Thriller Osvaldo Civirani  Italy
Under Ten Flags, History War Duilio Coletti Paramount Pictures Dino de Laurentiis Cinematografica Italy United States of America
The Shuttered Room, Drama Mystery Horror David Greene Seven Arts Productions United Kingdom
Sweet Deceptions, Romance Drama Alberto Lattuada  
Come Have Coffee with Us, Comedy Alberto Lattuada Mars Films Italy
Keep an Eye on Amelia, Comedy Claude Autant-Lara Lux Film Lux Compagnie Cinématographique de France Italy France
My Mistress, Romance Drama Stephen Lance Mini Studios Australia
SOS,Sällskapsresorna Comedy Lasse Åberg Smart Egg Pictures Cinema Art Svensk Filmindustri (SF) Viking Film Sweden
Slam Dance, Mystery Thriller Wayne Wang Sho Films Island Pictures Zenith Entertainment United Kingdom United States of America
Hababam Sınıfı Sınıfta Kaldı,Hababam Sınıfı Collection  Ertem Eğilmez  Turkey
Hotel Hell Vacation, Comedy Bryan Buckley  
Eddie Izzard: Circle, Comedy Anastasia Pappas  United Kingdom
Blue Rita, Action Thriller Jesús Franco Elite Film France Switzerland
The Song, Music Romance Drama Richard Ramsey City on a Hill Productions United States of America
The Adopted, Drama Mélanie Laurent TF1 Films Production Studio Canal France
The Hellfire Club, Adventure Robert S. Baker Monty Berman New World Productions United Kingdom
Tracers, Action Crime Drama Daniel Benmayor Temple Hill Entertainment Senator Film Freerunning Melbarken Saban Films Cowtown Cinema Ventures United States of America
Cose da pazzi,  Vincenzo Salemme  Italy
The Police Serve the Citizens?, Foreign Action Crime Romolo Guerrieri PECF Capital Films France Italy
Lost for Life, Crime Documentary Joshua Rofe  
Sailing to Paradise, Romance Comedy Drama Blaž Završnik SEVER & SEVER Slovenia
Hell Is a City, Crime Thriller Val Guest Hammer Film Productions United Kingdom
Laissons Lucie faire !, Romance Comedy Emmanuel Mouret  
Secrets of a Married Man, Drama William A. Graham ITC Entertainment United States of America
Gentlemen, Thriller Drama Romance Mikael Marcimain  Sweden
Hurricane, Drama TV Movie Jerry Jameson Metromedia Producers Corporation (MPC) United States of America
Profit Motive and the Whispering Wind, Documentary John Gianvito  
Infinitely Polar Bear, Comedy Drama Maya Forbes Paper Street Films Bad Robot Park Pictures KGB Media United States of America
Water's Edge, Thriller Harvey Kahn  
Basic Training, Comedy Andrew Sugerman Playboy Entertainment Group Entertainment Events United States of America
Hungry Hearts, Drama Saverio Costanzo Rai Cinema Wildside Italy
In Search of Memory, Documentary Petra Seeger  
Banning, Romance Drama Ron Winston Universal Pictures United States of America
Sinatra: All or Nothing at All, Documentary Alex Gibney  
Finding Gastón, Documentary Julia Patricia Perez Chiwake Films Peru
Driving Me Crazy, Comedy Jon Turteltaub PolyGram Filmed Entertainment United States of America
Terror Express, Drama Ferdinando Baldi  
Doug Stanhope: Beer Hall Putsch, Comedy Jay Karas New Wave Entertainment Television United States of America
Yasmin, Drama Kenneth Glenaan  Germany United Kingdom
I guappi non si toccano,  Mario Bianchi  
The Murder Man, Crime Drama Romance Thriller Tim Whelan Metro-Goldwyn-Mayer (MGM) United States of America
Gulaal, Crime Drama Foreign Anurag Kashyap Zee Limelight India
Uncle Vanya, Romance Drama Andrei Konchalovsky Mosfilm Russia
Hot Girls Wanted, Documentary Ronna Gradus Jill Bauer Two to Tangle Productions United States of America
Rich and Poor, Comedy Romance Pasquale Festa Campanile  Italy
Duck Amuck, Animation Chuck Jones Warner Bros. United States of America
Throw Down Your Heart, Documentary Music   
Il giocattolo,  Giuliano Montaldo  
Bluffmaster!, Drama Comedy Romance Foreign Rohan Sippy R.S. Entertainment Sahara One Entertainment India
Rockstar, Drama Music Romance Imtiaz Ali  
Kaminey, Action Crime Drama Vishal Bhardwaj  India
Return to Sleepaway Camp,Sleepaway Camp Collection Mystery Horror Comedy Robert Hiltzik Go2sho Return to Sleepaway corp. United States of America
Spectre,James Bond Collection Action Adventure Crime Sam Mendes Columbia Pictures Danjaq B24 United Kingdom United States of America
The Boom, Comedy Vittorio De Sica  
Clash of Egos, Comedy Tomas Villum Jensen Zentropa Entertainments Denmark
Pokémon: Jirachi Wish Maker,Pokémon Collection Action Animation Adventure Family Kunihiko Yuyama 4 Kids Entertainment Japan United States of America
The Surrogate, Drama Mystery Thriller Doug Campbell  
uwantme2killhim?," Drama Thriller Andrew Douglas Weinstein Company, The Bad Hat Harry Productions Anonymous Content Tribeca Film Jumping Jack Films eOne Entertainment United Kingdom"
Hyena, Drama Crime Gerard Johnson Film4 Number 9 Films United Kingdom
Chloé, Romance TV Movie Drama Dennis Berry Le Bureau France 2 (FR2) Belgium France
A Change of Heart, Drama Arvin Brown  United States of America
Good Morning... and Goodbye!, Crime Drama Russ Meyer  United States of America
Stung, Comedy Horror Benni Diez Rat Pack Filmproduktion XYZ Films United States of America Germany
"Helsinki, Forever",  Peter von Bagh  
Accidental Love, Romance Comedy David O. Russell Stephen Greene K. JAM Media United States of America
Meet Him And Die, Crime Franco Prosperi  
Staten Island Summer, Comedy Rhys Thomas Paramount Pictures United States of America
Come Dio comanda, Drama Gabriele Salvatores Rai Cinema Colorado Film Production Friuli Venezia Giulia Film Commission Italy
Due partite, Drama Enzo Monteleone Cattleya Italy
"Back to Back, Face to Face", Drama Huang Jianxin Xi'an Film Studio Simpson Communication Limited China
This Is What They Want,  Brian Koppelman David Levien  
Eli, Comedy Yuvaraj Dhayalan  
Taste of Killing, Western Tonino Valerii Hercules Cinematografica Films Montana Italy Spain
The Seventh Bullet, Adventure War Ali Khamrayev Uzbekfilm Uzbekistan
Draquila - L'Italia che trema,  Sabina Guzzanti Secol Superbo e Sciocco Produzioni Ambra Produzioni Italy
Irrational Man, Mystery Drama Woody Allen Sony Pictures Gravier Productions Perdido Productions United States of America
The Man Who Wasn't There, Fantasy Action Comedy Science Fiction Bruce Malmuth Paramount Pictures United States of America
Bad Behavior, Thriller Lisa Hamil Nicholas Brandt Beautiful Lie Pictures 
10 Cent Pistol, Action Crime Thriller Michael C. Martin Route 17 Entertainment United States of America
Ultrà, Documentary Ricky Tognazzi  
A Bottle in the Gaza Sea, Drama Thierry Binisti TS Productions France 3 (FR3) France
Inside Hana's Suitcase, Documentary Larry Weinstein  
Guest Wife, Comedy Romance Sam Wood United Artists United States of America
Men & Chicken, Comedy Drama Anders Thomas Jensen Det Danske Filminstitut Danmarks Radio (DR) M&M Productions Film Fyn DCM Productions Film i Väst Germany Denmark
The Black Shield Of Falworth, Adventure Rudolph Maté Universal International Pictures (UI) United States of America
Sakura Killers, Action wang yu Dusty Nelson  
Harbinger Down, Science Fiction Horror Alec Gillis Dark Dunes Productions Studio ADI United States of America
Sailor Moon S the Movie: Hearts in Ice,Sailor Moon Collection Animation Action Comedy Hiroki Shibata Pioneer Productions United States of America
Inner Demons, Thriller Horror Seth Grossman Schorr Pictures United States of America
Deck the Halls, Action Drama Mystery TV Movie Ron Underwood Reunion Pictures Frank von Zerneck Films RPI Group Productions 
The One That Got Away, Drama History War Roy Ward Baker The Rank Organisation Julian Wintle Productions United Kingdom
Spoiler, Science Fiction Thriller Horror Jeff Burr Ed Ancoats Inc. United States of America
The 7th Day, Drama Carlos Saura Lolafilms / Artedis Spain
Billy Wilder Speaks, Documentary Volker Schlöndorff Gisela Grischow  
Blind Man, Thriller Action Xavier Palud EuropaCorp. France
He Named Me Malala, Documentary Davis Guggenheim Participant Media Imagenation Abu Dhabi FZ Parkes+MacDonald Image Nation United Arab Emirates United States of America
Would I Lie to You? 2,Would I Lie to You? Collection Comedy Thomas Gilou TPS Cinéma TF1 Films Production M6 Métropole Télévision Télégraphe Vertigo France
Naked You Die, Mystery Foreign Antonio Margheriti Woolner Brothers Pictures Inc. BGA Super International Pictures Italy
The Assassin, Action Drama History Hou Hsiao-hsien Media Asia Films Sil-Metropole Organisation Central Motion Pictures Zhejiang Huace Film & TV China Dream Film Culture Industry SpotFilms China France Hong Kong Taiwan
Diane,  Alan Clarke  
Sriracha, Documentary Griffin Hammond  
Ghoul, Thriller Gregory Wilson Chiller Films United States of America
The Lost, Horror Crime Drama Thriller Chris Sivertson Silver Web Productions United States of America
Winning London, Comedy Family Craig Shapiro  United States of America
Beyond the Mask, Action Chad Burns Burns Family Studios United States of America
My Internship in Canada, Comedy Philippe Falardeau micro_scope Canada
Runt Page,Baby Burlesks  Ray Nazarro   
Chasuke's Journey, Drama Comedy SABU Office Kitano Japan
Spartacus, TV Movie Action Drama History Robert Dornhelm Nimar Studios USA Cable Entertainment United States of America
The Victim, Thriller Action Horror Michael Biehn BLT Productions Lotus Sound Blancbiehn Productions United States of America
The Hitcher II: I've Been Waiting,The Hitcher (1986) Collection Action Thriller Louis Morneau  United States of America
Torino nera, Drama Crime Carlo Lizzani  Italy
Tazza: The High Rollers,The War of Flower Collection Crime Comedy Dong-hun Choi  South Korea
Circle, Horror Science Fiction Aaron Hann Mario Miscione Votiv Films Taggart Productions United States of America
Imagination, Fantasy Drama Science Fiction Erik Leiser  
N: The Madness Of Reason, Documentary Peter Krüger  
Word of Honor, Drama Thriller   
Half Past Dead 2,Half Past Dead Collection Crime Action Art Camacho  United States of America
My Man, Romance Crime Drama Kazuyoshi Kumakiri  Dwango Happinet Corporation GyaO Japan
Huie's Sermon, Documentary Werner Herzog Werner Herzog Filmproduktion Süddeutscher Rundfunk (SDR) Germany
An Autumn's Tale, Drama Romance Mabel Cheung D & B Films Co. Ltd. Hong Kong
